Name,Age,CleanAge,Date,CleanDate,Location,Cause of death
Michael Clarke The Byrds,47,47,"December 19, 1993",1993-12-19,"Treasure Island, Florida, USA",Liver failure
"Eric ""Bingy Bunny"" Lamont The Morwells, Roots Radics",38,38,"December 31, 1993",1993-12-31,USA,Prostate Cancer
Harry Nilsson,52,52,"January 15, 1994",1994-01-15,"Agoura Hills, California, USA",Heart failure
Rhett Forrester Riot,37,37,"January 22, 1994",1994-01-22,"Atlanta, Georgia, USA",Gun shot
Papa John Creach Jefferson Airplane Jefferson Starship The Dinosaurs,76,76,"February 22, 1994",1994-02-22,"Los Angeles, California, USA",Pneumonia
Dan Hartman,43,43,"March 22, 1994",1994-03-22,"Westport, Connecticut, USA",Complications from AIDS
Kurt Cobain Nirvana,27,27,"April 5, 1994",1994-04-05,"Seattle, Washington, USA",Suicide by gunshot
Lee Brilleaux Dr. Feelgood,51,51,"April 7, 1994",1994-04-07,"Canvey Island, Essex, England",Lymphoma
Larry Davis,57,57,"April 19, 1994",1994-04-19,"Los Angeles, California, USA",Cancer
Joe Pass,65,65,"May 23, 1994",1994-05-23,"Los Angeles, California, USA",Liver cancer
Eric Gale,55,55,"May 25, 1994",1994-05-25,"Baja, California, Mexico",Lung cancer
Derek Leckenby Herman's Hermits,51,51,"June 4, 1994",1994-06-04,"Manchester, England",Non-Hodgkin lymphoma
"Kristen Pfaff Hole, Janitor Joe",27,27,"June 16, 1994",1994-06-16,"Seattle, Washington, USA",Heroin overdose
Eddie Boyd,79,79,"July 13, 1994",1994-07-13,"Helsinki, Finland, USA",
Major Lance,55,55,"September 3, 1994",1994-09-03,"Decatur, Georgia, USA",Heart disease
Nicky Hopkins The Jeff Beck Group,50,50,"September 6, 1994",1994-09-06,"Nashville, Tennessee, USA",Complications from intestinal surgery
"Ken ""Dimwit"" Montgomery D.O.A., Pointed Sticks, Subhumans",36,36,"September 27, 1994",1994-09-27,,Heroin overdose
Danny Gatton,49,49,"October 4, 1994",1994-10-04,"Newburg, Maryland, USA",Suicide by gunshot
Lee Allen,67,67,"October 18, 1994",1994-10-18,"Los Angeles, California, USA",
"Jimmy Miller Record producer for Blind Faith, Spooky Tooth, Motörhead, Primal Scream, and association with The Rolling Stones",52,52,"October 22, 1994",1994-10-22,"Denver, Colorado, USA",Liver failure
Wilbert Harrison,65,65,"October 26, 1994",1994-10-26,"Spencer, North Carolina, USA",Stroke
Robert White The Funk Brothers,57,57,"October 27, 1994",1994-10-27,"Los Angeles, California, USA",Complications from open heart surgery
"Fred ""Sonic"" Smith MC5 Sonic's Rendezvous Band",45,45,"November 4, 1994",1994-11-04,"Detroit, Michigan, USA",Heart failure
Tommy McManus Mama's Boys,53,53,"November 16, 1994",1994-11-16,"London, England",Lung infenction and following by a bone marrow
Chet Powers Quicksilver Messenger Service,57,57,"November 16, 1994",1994-11-16,"Santa Rosa, California, USA",
Garnett Silk,28,28,"December 9, 1994",1994-12-09,"Mandeville, Jamaica, USA",
"Dan Hamilton Hamilton, Joe Frank & Reynolds",51,51,"December 23, 1994",1994-12-23,"Los Angeles, California, USA",Cushig's syndrome
Johnny Carroll,57,57,"January 13, 1995",1995-01-13,"Dallas, Texas, USA",Liver failure
Ruby Starr Black Oak Arkansas,45,45,"January 14, 1995",1995-01-14,"Toledo, Ohio, USA",Lung cancer
"Denny Cordell Record producer from The Hollies, The Moody Blues, The Move",51,51,"February 18, 1995",1995-02-18,"Dublin, Ireland",Lymphoma
Bob Stinson The Replacements Static Taxi,35,35,"February 18, 1995",1995-02-18,"Minneapolis, Minnesota, USA",Health undermined by years of alcohol and drug abuse
Melvin Franklin The Temptations,52,52,"February 23, 1995",1995-02-23,"Sherman Oaks, California, USA",Complications from a seizure
Vivian Stanshall Bonzo Dog Doo-Dah Band,51,51,"March 5, 1995",1995-03-05,"Muswell Hill, London, England",House fire
Delroy Wilson,46,46,"March 6, 1995",1995-03-06,"Kingston, Jamaica, USA",Cirrhosis of the liver
Ingo Schwichtenberg Helloween,29,29,"March 8, 1995",1995-03-08,"Hamburg, West Germany",Suicide
Sunnyland Slim,88,88,"March 17, 1995",1995-03-17,"Chicago, Illinois, USA",
Nike Ardilla,19,19,"March 19, 1995",1995-03-19,"Bandung, Indonesia",Car accident
"Alan Barton Smokie, Black Lace",41,41,"March 23, 1995",1995-03-23,"Cologne, Germany",Bus accident
Eazy-E N.W.A,30,30,"March 26, 1995",1995-03-26,"Compton, California, USA",Complications due to AIDS
Jimmy McShane Baltimora,37,37,"March 29, 1995",1995-03-29,"Derry, Northern Ireland",Complications due to AIDS
Selena,23,23,"March 31, 1995",1995-03-31,"Corpus Christi, Texas, USA",Shot to death by Yolanda Saldívar
Burl Ives,85,85,"April 14, 1995",1995-04-14,"Anacortes, Washington, USA",Oral cancer
Carl Albert Vicious Rumors,32,32,"April 22, 1995",1995-04-22,,Car accident
Lonesome Sundown,66,66,"April 23, 1995",1995-04-23,"Gonzales, Louisiana, USA",
Clarence Paul,67,67,"May 6, 1995",1995-05-06,"Los Angeles, California, USA",Complications of heart disease and diabetes
Sims Ellison Pariah,28,28,"June 6, 1995",1995-06-06,"Austin, Texas, USA",Suicide by gunshot
Rory Gallagher,47,47,"June 14, 1995",1995-06-14,"London, England",MRSA complications following a liver transplant
Phyllis Hyman,45,45,"June 30, 1995",1995-06-30,"New York City, New York, USA",Drug overdose
Wolfman Jack American DJ,57,57,"July 1, 1995",1995-07-01,"Belvidere, North Carolina, USA",Heart attack
Charlie Rich,62,62,"July 25, 1995",1995-07-25,"Hammond, Louisiana, USA",Acute blood clot
Jerry Garcia The Grateful Dead,53,53,"August 9, 1995",1995-08-09,"Forest Knolls, California, USA",Heart attack
Ronald White Smokey Robinson & The Miracles,56,56,"August 26, 1995",1995-08-26,"Detroit, Michigan, USA",Leukemia
Sterling Morrison The Velvet Underground,53,53,"August 30, 1995",1995-08-30,"Poughkeepsie, New York, USA",Cancer
Shannon Hoon Blind Melon,28,28,"October 21, 1995",1995-10-21,"New Orleans, Louisiana, USA",Cocaine overdose
Alan Hull Lindisfarne,50,50,"November 17, 1995",1995-11-17,"Newcastle, England",Heart thrombosis
"Matthew Ashman Bow Wow Wow, Adam and the Ants",35,35,"November 21, 1995",1995-11-21,"London, England",Diabetes
"Peter Grant Music manager from Stone the Crows, The Yardbirds, Led Zeppelin, Bad Company and record executive from Swan Song Records",60,60,"November 21, 1995",1995-11-21,"Eastbourne, Sussex, England, United Kingdom",
Tom Clay American radio personality and disc jockey,66,66,"November 22, 1995",1995-11-22,"Los Angeles, California, USA",Stomach and lung cancer
Junior Walker Junior Walker & the All Stars,64,64,"November 23, 1995",1995-11-23,"Battle Creek, Michigan, USA",Cancer
Dean Martin,78,78,"December 25, 1995",1995-12-25,"Beverly Hills, California, USA",Lung cancer
Maxwell Street Jimmy Davis,70,70,"December 28, 1995",1995-12-28,"Chicago, Illinois, USA",Heart attack
Edem Ephraim London Boys,36,36,"January 21, 1996",1996-01-21,"Eastern Alps, Austria",Car accident
Dennis Fuller London Boys,36,36,"January 21, 1996",1996-01-21,"Eastern Alps, Austria",Car accident
Brownie McGhee,80,80,"February 16, 1996",1996-02-16,"Oakland, California, USA",Stomach cancer
Billy Williamson Bill Haley & His Comets,71,71,"March 22, 1996",1996-03-22,"Swarthmore, Pennsylvania, USA",Cancer
Don Murray The Turtles,50,50,"March 22, 1996",1996-03-22,"Glendale, California, USA",Complications following ulcer surgery
Jeffrey Lee Pierce The Gun Club,37,37,"March 31, 1996",1996-03-31,"Salt Lake City, Utah, USA",Cerebral hemorrhage
Guitar Gabriel,70,70,"April 2, 1996",1996-04-02,"Winston-Salem, North Carolina, USA",
Bernard Edwards Chic,43,43,"April 18, 1996",1996-04-18,Japan,Pneumonia
"Johnny ""Guitar"" Watson",61,61,"May 18, 1996",1996-05-18,"Yokohama, Japan",Myocardial infraction
Kevin Gilbert,29,29,"May 18, 1996",1996-05-18,"Los Angeles, California, USA",Accidental strangulation
Bradley Nowell Sublime,28,28,"May 25, 1996",1996-05-25,"San Francisco, California, USA",Heroin overdose
Ella Fitzgerald,79,79,"June 15, 1996",1996-06-15,"Beverly Hills, California, USA",Complications from diabetes
Jim Ellison Material Issue,32,32,"June 20, 1996",1996-06-20,USA,Suicide from carbon monoxide poisoning
Louis Gottlieb The Limeliters,72,72,"July 11, 1996",1996-07-11,"Sebastopol, California, USA",Short illness
Jonathan Melvoin The Smashing Pumpkins,34,34,"July 12, 1996",1996-07-12,"New York City, New York, USA",Heroin overdose
John Panozzo Styx,47,47,"July 16, 1996",1996-07-16,"Chicago, Illinois, USA",Gastrointestinal hemorrhaging
Chas Chandler The Animals,57,57,"July 17, 1996",1996-07-17,"Heaton, Newcastle upon Tyne, England",Heart condition
Rob Collins The Charlatans,33,33,"July 22, 1996",1996-07-22,Wales,Car accident
Marge Ganser The Shangri-Las,48,48,"July 28, 1996",1996-07-28,"New York City, New York, USA",Breast cancer
"Jason Thirsk Pennywise, Humble Gods",28,28,"July 29, 1996",1996-07-29,,Self-inflicted gunshot
Mel Taylor The Ventures,62,62,"August 11, 1996",1996-08-11,"Los Angeles, California, USA",Lung cancer
Tupac Shakur,25,25,"September 13, 1996",1996-09-13,"Las Vegas, Nevada, USA",Shot
Chris Acland Lush,30,30,"October 17, 1996",1996-10-17,"Burneside, South Lakeland, Cumbria, England",Suicide
Eva Cassidy,33,33,"November 2, 1996",1996-11-02,"Bowie, Maryland, USA",Cancer
William Clarke,45,45,"November 2, 1996",1996-11-02,"Fresno, California, USA",
Tiny Tim,64,64,"November 30, 1996",1996-11-30,"Minneapolis, Minnesota, USA",Heart attack
Patty Donahue The Waitresses,40,40,"December 9, 1996",1996-12-09,"Cleveland, Ohio, USA",Lung cancer
"Dawn Crosby Detente, Fear of God",33,33,"December 15, 1996",1996-12-15,,Liver failure
Randy California Spirit,45,45,"January 2, 1997",1997-01-02,"Molokai, Hawaii, USA",Drowned
"Alexander Young Marcus Hook Roll Band, AC/DC",58,58,"January 4, 1997",1997-01-04,"Hamburg, Germany",Lung cancer
Kenny Pickett The Creation,54,54,"January 10, 1997",1997-01-10,"London, England",Heart attack
Keith Diamond,46,46,"January 18, 1997",1997-01-18,"Manhattan, USA",
Billy Mackenzie Associates,39,39,"January 22, 1997",1997-01-22,"Angus, Scotland",Prescription pill overdose
Richard Berry,61,61,"January 23, 1997",1997-01-23,"Inglewood, California, USA",Heart failure
Seth Lover,87,87,"January 31, 1997",1997-01-31,"Garden Grove, California, USA",
Brian Connolly The Sweet,52,52,"February 9, 1997",1997-02-09,"Slough, Berkshire, England",Kidney failure
Jack Owens,92,92,"February 9, 1997",1997-02-09,"Yazoo City, Mississippi, USA",
Notorious B.I.G.,24,24,"March 9, 1997",1997-03-09,"Los Angeles, California, USA",Homicide
LaVern Baker,67,67,"March 10, 1997",1997-03-10,"Queens, New York, USA",Coronary complications
Ronnie Barron,53,53,"March 20, 1997",1997-03-20,,Heart failure
Harold Melvin Harold Melvin & the Bluenotes,57,57,"March 24, 1997",1997-03-24,,
Laura Nyro,49,49,"April 8, 1997",1997-04-08,"Danbury, Connecticut, USA",Ovarian cancer
"Eldon Hoke Mentors, The Screamers",39,39,"April 19, 1997",1997-04-19,"Riverside, California, USA",Struck by train
Lovie Lee,88,88,"May 23, 1997",1997-05-23,"Chicago, Illinois, USA",
Jeff Buckley,30,30,"May 29, 1997",1997-05-29,"Memphis, Tennessee, USA",Accidental drowning
"Ronnie Lane The Small Faces, Faces",51,51,"June 4, 1997",1997-06-04,"Trinidad, Colorado, USA",Pneumonia
John Wolters Dr. Hook & the Medicine Show,52,52,"June 16, 1997",1997-06-16,,
Bobby Helms,63,63,"June 19, 1997",1997-06-19,"Martinsville, Indiana, USA",Emphysema and asthma
Lawrence Payton The Four Tops,59,59,"June 20, 1997",1997-06-20,"Southfield, Michigan, USA",Cancer
"Louis A. McCall, Sr. Con Funk Shun",45,45,"June 25, 1997",1997-06-25,"Stone Mountain, Georgia, USA",Murder
Johnny Copeland,60,60,"July 3, 1997",1997-07-03,"Harlem, New York, USA",Congential heart defect
Chuck Wayne,74,74,"July 29, 1997",1997-07-29,USA,Health problems
Luther Allison,57,57,"August 12, 1997",1997-08-12,"Madison, Wisconsin, USA",Metastasis
"Raymond Barbieri Warzone, Agnostic Front",35,35,"September 11, 1997",1997-09-11,"New York City, New York, USA",Pneumonia
Jimmy Witherspoon,77,77,"September 18, 1997",1997-09-18,"Los Angeles, California, USA",Throat cancer
John Denver,53,53,"October 12, 1997",1997-10-12,"Pacific Grove, California, USA",Plane accident
Glen Buxton,49,49,"October 19, 1997",1997-10-19,"Clarion, Iowa, USA",Pneumonia
Henry Vestine Canned Heat,52,52,"October 20, 1997",1997-10-20,"Paris, France",Heart and respiratory failure
Epic Soundtracks Swell Maps Crime & the City Solution These Immortal Souls,38,38,"November 6, 1997",1997-11-06,"West Hampstead, London, England",Inconclusive official cause
Tommy Tedesco,67,67,"November 10, 1997",1997-11-10,"Northridge, California, USA",Lung cancer
Michael Hutchence INXS,37,37,"November 22, 1997",1997-11-22,"Sydney, Australia",Suicide or accidental strangulation
Kurt Winter The Guess Who,51,51,"December 14, 1997",1997-12-14,,Kidney failure due to previous drug abuse
Nicolette Larson,45,45,"December 16, 1997",1997-12-16,"Los Angeles, California, USA",Cerebral edema and liver failure
Jimmy Rogers,73,73,"December 19, 1997",1997-12-19,"Chicago, Illinois, USA",
Floyd Cramer,64,64,"December 31, 1997",1997-12-31,,Lung cancer
Nick Venet Record producer and association with The Beach Boys,61,61,"January 2, 1998",1998-01-02,,
Sonny Bono Sonny & Cher,62,62,"January 5, 1998",1998-01-05,"South Lake Tahoe, California, USA",Skiing accident
"Ken Forssi The Surfaris, Love",54,54,"January 10, 1998",1998-01-10,"Tallahassee, Florida, USA",Brain tumor
Junior Wells The Aces,63,63,"January 15, 1998",1998-01-15,"Chicago, Illinois, USA",Sereve health problems include a cancer and a heart attack
Carl Perkins,65,65,"January 19, 1998",1998-01-19,"Jackson, Tennessee, USA",Throat cancer
Fat Pat,27,27,"February 3, 1998",1998-02-03,"Houston, Texas, USA",Murdered by gunshot
Tim Kelly Slaughter,35,35,"February 5, 1998",1998-02-05,"Bagdad, Arizona, USA",Car crash
"Joe Stubbs The Falcons, The Contours, The Originals",55-56,55,"February 5, 1998",1998-02-05,USA,
Falco,40,40,"February 6, 1998",1998-02-06,"Puerto Plata, Dominican Republic",Car accident
Carl Wilson The Beach Boys,51,51,"February 6, 1998",1998-02-06,"Los Angeles, California, USA",Lung cancer
Grandpa Jones,84,84,"February 19, 1998",1998-02-19,"Nashville, Tennessee, USA",2 strokes
"Rozz Williams Christian Death, Shadow Project, Premature Ejaculation",34,34,"April 1, 1998",1998-04-01,"West Hollywood, California, USA",Suicide by hanging
Rob Pilatus Milli Vanilli,33,33,"April 2, 1998",1998-04-02,"Frankfurt, Germany",Alcohol and prescription pill overdose
"Cozy Powell The Jeff Beck Group, Rainbow, Whitesnake, Black Sabbath",50,50,"April 5, 1998",1998-04-05,"Bristol, England",Car accident
Wendy O. Williams Plasmatics,48,48,"April 6, 1998",1998-04-06,"Storrs, Connecticut, USA",Suicide by shooting
Linda McCartney Wife of former Beatle Paul McCartney Wings,56,56,"April 17, 1998",1998-04-17,"Tucson, Arizona, USA",Breast cancer
"hide X Japan, Zilch",33,33,"May 2, 1998",1998-05-02,"Tokyo, Japan",Suicide by hanging
Eddie Rabbitt,56,56,"May 7, 1998",1998-05-07,"Nashville, Tennessee, USA",Lung cancer
Frank Sinatra,82,82,"May 14, 1998",1998-05-14,"West Hollywood, California, USA",Heart attack
Jerry Capehart,69,69,"June 7, 1998",1998-06-07,"Nashville, Tennessee, USA",Brain Cancer
Johnny Adams,66,66,"September 14, 1998",1998-09-14,"Baton Rouge, Louisiana, USA",Cancer
Oz Bach Spanky and Our Gang,59,59,"September 21, 1998",1998-09-21,"Asheville, North Carolina, USA",Cancer
Gene Autry,91,91,"October 2, 1998",1998-10-02,"Studio City, California, USA",Lymphoma
Lonnie Pitchford,43,43,"November 8, 1998",1998-11-08,"Lexington, Mississippi, USA",HIV/AIDS
Lynn Strait Snot,30,30,"December 11, 1998",1998-12-11,"Santa Barbara, California, USA",Car accident
Bryan Maclean Love,52,52,"December 25, 1998",1998-12-25,"Los Angeles, California, USA",Heart attack
Johnny Moore The Drifters,64,64,"December 30, 1998",1998-12-30,"London, England",Respiratory failure
Sonny Forriest The Coasters,64,64,"January 10, 1999",1999-01-10,"Capitol Heights, Maryland, USA",
John Baker Saunders Mad Season The Walkabouts,44,44,"January 15, 1999",1999-01-15,"Seattle, Washington, USA",Heroin overdose
"David McComb The Triffids, Blackeyed Susans",36,36,"February 2, 1999",1999-02-02,"Melbourne, Victoria, Australia",Heroin toxicity and rejection of his 1996 heart transplant
Gwen Guthrie,48,48,"February 3, 1999",1999-02-03,"Orange, New Jersey, USA",Uterine cancer
Buddy Knox,65,65,"February 14, 1999",1999-02-14,"Bremerton, Washington, USA",Lung cancer
David Ackles,62,62,"March 2, 1999",1999-03-02,"Tujunga, California, USA",Lung cancer
Dusty Springfield The Springfields,59,59,"March 2, 1999",1999-03-02,"Henley-on-Thames, Oxfordshire, England",Cancer
Lowell Fulson,77,77,"March 7, 1999",1999-03-07,"Long Beach, California, USA",
Peppermint Harris,73,73,"March 19, 1999",1999-03-19,"Elizabeth, New Jersey, USA",
Val Valentin Record proudcer and record engineer,79,79,"March 24, 1999",1999-03-24,"Reno, Nevada, USA",
Joe Williams,80,80,"March 29, 1999",1999-03-29,"Las Vegas, Nevada, USA",
Skip Spence Jefferson Airplane Moby Grape,52,52,"April 16, 1999",1999-04-16,"Santa Cruz, California, USA",Lung cancer
Kemistry Kemistry & Storm,35,35,"April 25, 1999",1999-04-25,"Winchester, Hampshire, England",
Roger Troutman Zapp,47,47,"April 25, 1999",1999-04-25,"Dayton, Ohio, USA",Murdered by his brother Larry Troutman
Larry Troutman Zapp,54,54,"April 25, 1999",1999-04-25,"Dayton, Ohio, USA",Committed suicide after he murdered his brother Roger Troutman
"Adrian Borland The Outsiders, The Sound",41,41,"April 26, 1999",1999-04-26,"London, England",Suicide
Darrell Sweet Nazareth,51,51,"April 30, 1999",1999-04-30,"New Albany, Indiana, USA",Heart attack
William Tucker Ministry,38,38,"May 14, 1999",1999-05-14,,Heart attack
"Bruce Fairbairn Record producer from Van Halen, Bon Jovi, Aerosmith, AC/DC",49,49,"May 17, 1999",1999-05-17,"Vancouver, British Columbia, Canada",
Billy Brown The Freshmen,56,56,"Jine 6, 1999",1999-06-06,,
Screaming Lord Sutch,58,58,"June 16, 1999",1999-06-16,"West Harrow, Middlesex, England",Suicide by hanging
Kami Malice Mizer,26,26,"June 21, 1999",1999-06-21,,Subarachnoid hemorrhage
Dennis Brown,42,42,"July 1, 1999",1999-07-01,"Kingston, Jamaica, USA",Pneumothorax
Guy Mitchell,72,72,"July 1, 1999",1999-07-01,"Las Vegas, Nevada, USA",Cancer surgery
Mark Sandman Morphine,46,46,"July 3, 1999",1999-07-03,"Palestrina, Latium, Italy",On stage heart attack
Kevin Wilkinson,41,41,"July 17, 1999",1999-07-17,,
Gar Samuelson Megadeth,41,41,"July 22, 1999",1999-07-22,"Orange City, Florida, USA",Liver failure
Tommy Ridgley,73,73,"August 11, 1999",1999-08-11,,Kidney failure and lung cancer
Bobby Sheehan Blues Traveler,31,31,"August 20, 1999",1999-08-20,"New Orleans, Louisiana, USA",Drug overdose
Rob Fisher Naked Eyes,42,42,"August 25, 1999",1999-08-25,,Cancer
Beau Jocque,45,45,"September 10, 1999",1999-09-10,"Kinder, Louisiana, USA",Heart attack
Claude Bessy Catholic Discipline,53,53,"October 2, 1999",1999-10-02,"Barcelona, Spain",Lung cancer
"Erik Brødreskift Borknagar, Gorgoroth",29,29,"October 4, 1999",1999-10-04,,Suicide by drug overdose
Hoyt Axton,61,61,"October 26, 1999",1999-10-26,"Victor, Montana, USA",Heart attack
Wes Berggren Tripping Daisy,28,28,"October 27, 1999",1999-10-27,"Dallas, Texas, USA",Drug overdose
Rob Hoeke,60,60,"November 6, 1999",1999-11-06,"Krommenie, Netherlands, USA",Short illness
"Herb Abramson Record company executive, record producer and co-founder of Atlantic Records",82,82,"November 9, 1999",1999-11-09,"Henderson, Nevada, USA",
Clifford Jarvis,58,58,"November 26, 1999",1999-11-26,"London, England",
"Johnny ""Big Moose"" Walker",72,72,"November 27, 1999",1999-11-27,"Chicago, Illinois, USA",
"Don ""Sugarcane"" Harris Don and Dewey",61,61,"December 1, 1999",1999-12-01,"Los Angeles, California, USA",
Charlie Byrd,74,74,"December 2, 1999",1999-12-02,"Annapolis, Maryland, USA",Lung cancer
Bobby Marchan,69,69,"December 5, 1999",1999-12-05,"Gretna, Louisiana, USA",Liver Cancer
Rick Danko The Band,56,56,"December 10, 1999",1999-12-10,"Marbletown, New York, USA",Heart failure
Grover Washington Jr.,56,56,"December 17, 1999",1999-12-17,"New York City, New York, USA",Heart attack
Joe Higgs,59,59,"December 18, 1999",1999-12-18,,
Curtis Mayfield The Impressions,57,57,"December 26, 1999",1999-12-26,"Roswell, Georgia, USA",Complications due to diabetes
Nat Adderley Cannonball Adderley's brother,68,68,"January 2, 2000",2000-01-02,"Lakeland, Florida, USA",Diabetes
"Richard ""Dimples"" Fields",57,57,"January 12, 2000",2000-01-12,"Novato, California, USA",Stroke
Dub Jones The Coasters,71,71,"January 16, 2000",2000-01-16,"Long Beach, California, USA",Diabetes
Doris Coley The Shirelles,58,58,"February 4, 2000",2000-02-04,"Sacramento, California, USA",Breast cancer
Dave Peverett Foghat,58,58,"February 7, 2000",2000-02-07,"Orlando, Florida, USA",Kidney cancer
Screamin' Jay Hawkins,70,70,"February 12, 2000",2000-02-12,"Neuilly-sur-Seine, France",Complications following surgery concerning aneurysm
Andy Lewis The Whitlams,33,33,"February 12, 2000",2000-02-12,USA,
Oliver,54,54,"February 12, 2000",2000-02-12,"Shreveport, Louisiana, USA",Cancer
Dennis Danell Social Distortion,38,38,"February 29, 2000",2000-02-29,"Costa Mesa, California, USA",Brain aneurysm
Ian Dury Ian Dury and the Blockheads,57,57,"March 27, 2000",2000-03-27,"Upminster, London, England",Liver cancer
Heinz Burt The Tornados,57,57,"April 7, 2000",2000-04-07,"Southampton, England",Motor neurone disease
Vicki Sue Robinson,45,45,"April 27, 2000",2000-04-27,"Wilton, Connecticut, USA",Cancer
Bobbi Martin,60,60,"May 2, 2000",2000-05-02,"Baltimore, Maryland, USA",Cancer
Geoff Goddard,62,62,"May 15, 2000",2000-05-15,USA,
Johnnie Taylor,66,66,"May 31, 2000",2000-05-31,"Dallas, Texas, USA",Heart attack
Clive Westlake,67,67,"June 17, 2000",2000-06-17,"Pegram, Tennessee, USA",
Chuck Briggs U.S. Bombs,40,40,"July 4, 2000",2000-07-04,,AIDS related complications
Yuri Klinskikh Sektor Gaza,35,35,"July 4, 2000",2000-07-04,"Voronezh, Russia",Heart attack
"Paul Young Mike + The Mechanics, Sad Café",53,53,"July 15, 2000",2000-07-15,"Hale, Altrincham, USA",Cardiac arrest
Alan Caddy Johnny Kidd & The Pirates The Tornados,60,60,"August 16, 2000",2000-08-16,,Complications due to alcoholism
"Jack Nitzsche Crazy Horse, The Rolling Stones",63,63,"August 25, 2000",2000-08-25,"Hollywood, Los Angeles, California, USA",Cardiac arrest
Allen Woody The Allman Brothers Band Gov't Mule,44,44,"August 26, 2000",2000-08-26,"New York City, New York, USA",Heroin overdose
David Brown Santana,53,53,"September 4, 2000",2000-09-04,,Liver and kidney failure
Benjamin Orr The Cars,53,53,"October 3, 2000",2000-10-03,"Atlanta, Georgia, USA",Pancreatic cancer
Joachim Nielsen Jokke & Valentinerne,36,36,"October 17, 2000",2000-10-17,"Oslo, Norway",Heroin overdose
"Joe Nanini Black Randy and the Metrosquad, Wall of Voodoo",45,45,"December 4, 2000",2000-12-04,"Atlanta, Georgia, USA",
Kirsty MacColl,41,41,"December 18, 2000",2000-12-18,"Cozumel, Mexico",Hit by powerboat
"Rob Buck 10,000 Maniacs",42,42,"December 19, 2000",2000-12-19,"Pittsburgh, Pennsylvania, USA",Liver disease
Pops Staples The Staple Singers,85,85,"December 19, 2000",2000-12-19,"Chicago, Illinois, USA",Injuries from fall
Nick Massi The Four Seasons,73,73,"December 24, 2000",2000-12-24,"West Orange, New Jersey, USA",Cancer
Milan Hlavsa Plastic People of the Universe,49,49,"January 5, 2001",2001-01-05,"Prague, Czech Republic",Lung cancer
Bryan Gregory The Cramps,49,49,"January 10, 2001",2001-01-10,"Anaheim, California, USA",Multiple systems failure
Jack McDuff,74,74,"January 23, 2001",2001-01-23,"Minneapolis, Minnesota, USA",Heart Failure
Debbie Dean,73,73,"February 17, 2001",2001-02-17,"Ojai, California, USA",
John Fahey,61,61,"February 22, 2001",2001-02-22,USA,
Glenn Hughes Village People,50,50,"March 4, 2001",2001-03-04,"New York City, New York, USA",Lung Cancer
John Phillips The Mamas & the Papas,65,65,"March 18, 2001",2001-03-18,"Los Angeles, California, USA",Heart failure
Herbie Jones,74,74,"March 19, 2001",2001-03-19,"New York City, New York, USA",Diabetes
Big Daddy Kinsey,74,74,"April 3, 2001",2001-04-03,,Prostate cancer
Charles Pettigrew Charles & Eddie,37,37,"April 6, 2001",2001-04-06,"Philadelphia, Pennsylvania, USA",Cancer
Sandy Bull,60,60,"April 11, 2001",2001-04-11,,
Joey Ramone The Ramones,49,49,"April 15, 2001",2001-04-15,"New York City, New York, USA",Lymphoma
James E. Myers Record producer from Bill Haley & His Comets,81,81,"May 10, 2001",2001-05-10,"Bonita Springs, USA",
Perry Como,88,88,"May 12, 2001",2001-05-12,"Jupiter Inlet Colony, Florida, USA",Alzheimer's disease
Prince Ital Joe,38,38,"May 16, 2001",2001-05-16,"Phoenix, Arizona, USA",Car accident
Carole Fredericks,49,49,"June 7, 2001",2001-06-07,"Dakar, Senegal",
Marcelo Fromer Titãs,39,39,"June 13, 2001",2001-06-13,"São Paulo, São Paulo, Brazil",Hit by a motorcycle
Davorin Popović Indexi,54,54,"June 18, 2001",2001-06-18,"Sarajevo, Bosnia and Herzegovina",
John Lee Hooker,88,88,"June 21, 2001",2001-06-21,"Los Altos, California, USA",Natural causes
Ernie K-Doe,65,65,"July 5, 2001",2001-07-05,"New Orleans, Louisiana, USA",Kidney and liver failure
Mimi Fariña,56,56,"July 18, 2001",2001-07-18,"Mill Valley, California, USA",Neuroendocrine tumor
Milt Gabler Record proudcer,90,90,"July 20, 2001",2001-07-20,"Manhattan, New York,",
Richie Lee Acetone,34,34,"July 23, 2001",2001-07-23,,Suicide
Leon Wilkeson Lynyrd Skynyrd,49,49,"July 27, 2001",2001-07-27,"Ponte Vedra Beach, Florida, USA",Natural causes
Ronald Townson The 5th Dimension,68,68,"August 2, 2001",2001-08-02,"Las Vegas, Nevada, USA",Renal failure
Betty Everett,61,61,"August 19, 2001",2001-08-19,"South Beloit, Illinois, USA",
Aaliyah,22,22,"August 25, 2001",2001-08-25,"Abaco Islands, Bahamas",Plane accident
"Graeme Strachan Skyhooks, The Party Boys",49,49,"August 29, 2001",2001-08-29,"Mount Archer, Queensland, Australia",
