Name,Age,CleanAge,Date,CleanDate,Location,Cause of death
L.V. Banks,78,78,"May 2, 2011",2011-05-02,"Chicago, Illinois, USA",Heart Failure
Nigel Pickering Spanky and Our Gang,81,81,"May 5, 2011",2011-05-05,"St. Augustine, Florida, USA",
Cornell Dupree,68,68,"May 8, 2011",2011-05-08,"Fort Worth, USA",Lung transplant as a result of suffering from emphysema
Ivo Pešák Banjo Band,66,66,"May 9, 2011",2011-05-09,"Prague, Czech Republic",Complications from bypass surgery
Andrew Gold Wax,59,59,"June 3, 2011",2011-06-03,"Los Angeles, California, USA",Heart failure
"David ""Frankie"" Toler Great Southern, The Allman Brothers Band",59,59,"June 4, 2011",2011-06-04,"Bradenton, Florida, USA",Complications from liver transplant
Chumly Porter Dirty Rotten Imbeciles,41,41,"June 6, 2011",2011-06-06,,Suicide
"Seth Putnam Anal Cunt, Upsidedown Cross",43,43,"June 11, 2011",2011-06-11,,Heart attack
Jamie Toulon Old Skull Star Fucking Hipsters,30,30,"June 12, 2011",2011-06-12,"Lynchburg, Virginia, USA",
Carl Gardner The Coasters,83,83,"June 12, 2011",2011-06-12,"Port St. Lucie, Florida, USA",Congestive heart failure and vascular dementia
Mario Comesanas Liquid Metal,30,30,"June 13, 2011",2011-06-13,"Jersey City, New Jersey, USA",Brain hemorrhage
Clarence Clemons E Street Band,69,69,"June 18, 2011",2011-06-18,"Palm Beach, Florida, USA",Complications caused by stroke
Würzel Motörhead,61,61,"July 9, 2011",2011-07-09,,Ventricular tachycardia
Rob Grill The Grass Roots,67,67,"July 11, 2011",2011-07-11,"Orlando, Florida, USA",Complications caused by stroke and subsequent head injury
"Taiji Sawada X Japan, Loudness",45,45,"July 17, 2011",2011-07-17,"Saipan, Commonwealth of Northern Marianas Islands, USA",Suicide by hanging
Amy Winehouse,27,27,"July 23, 2011",2011-07-23,"London, England",Fatal alcohol poisoning within a framework of drug addiction and eating disorders
Bill Morrissey,59,59,"July 24, 2011",2011-07-24,"Dalton, Georgia, USA",Heart Disease
Dan Peek America,60,60,"July 24, 2011",2011-07-24,"Farmington, Missouri, USA",Heart disease
Daniel Bobis Cipher,32,32,"Went missing on July 24, 2011 Body found July 28, 2011",2011-07-24,"Jakarta, Republic of Indonesia",Lost at sea by surfing
Gene McDaniels,76,76,"July 29, 2011",2011-07-29,"Kittery Point, Maine, USA",
Andrew McDermott Threshold,45,45,"August 4, 2011",2011-08-04,England,Kidney failure
Jani Lane Warrant,47,47,"August 11, 2011",2011-08-11,"Los Angeles, California, USA",Acute alcohol poisoning
Jerry Leiber Jerry Leiber and Mike Stoller,78,78,"August 22, 2011",2011-08-22,"San Francisco, California, USA",Cardiopulmonary failure
Nickolas Ashford Ashford & Simpson,70,70,"August 22, 2011",2011-08-22,"New York City, New York, USA",Throat cancer
Johnny Giosa BulletBoys,42,42,"August 28, 2011",2011-08-28,"Los Angeles, California, USA",Car crash
"David ""Honeyboy"" Edwards",96,96,"August 29, 2011",2011-08-29,USA,Congestive heart failure
McKinley Williams Percussionist for Maze,65,65,"September 2, 2011",2011-09-02,"Chattanooga, Tennessee, USA",Cardiopulmonary failure
Jonas Bergqvist Lifelover,25,25,"September 9, 2011",2011-09-09,Sweden,Possible heart failure
"Willie ""Big Eyes"" Smith",75,75,"September 16, 2011",2011-09-16,"Chicago, Illinois, USA",Stroke
John Du Cann Atomic Rooster,65,65,"September 21, 2011",2011-09-21,"Hampstead, North West London, England",
Sylvia Robinson,75,75,"September 29, 2011",2011-09-29,"Secaucus, New Jersey, USA",Congestive heart failure
Marv Tarplin The Miracles,70,70,"September 30, 2011",2011-09-30,"Las Vegas, Nevada, USA",Natural causes
Mikey Welsh Weezer,40,40,"October 8, 2011",2011-10-08,"Chicago, Illinois, USA",Cardiac arrest
Flattus Maximus Gwar,34,34,"November 3, 2011",2011-11-03,"North Dakota, USA",Heart attack
Andrea True,68,68,"November 7, 2011",2011-11-07,"Kingston, New York, New York, USA",Congestive heart failure
Heavy D Heavy D & the Boyz,44,44,"November 8, 2011",2011-11-08,"Los Angeles, California, USA",Blood clot in the lungs
"Jonas R.""Slavia"" Christiansen Koldbrann",31,31,"November 17, 2011",2011-11-17,,Cancer
Lisa Faye Beatty 7 Year Bitch,47,47,"November 25, 2011",2011-11-25,"Mentone, California, USA",
Keef Hartley Keef Hartley Band,67,67,"November 26, 2011",2011-11-26,USA,
Howard Tate,72,72,"December 2, 2011",2011-12-02,"Burlington, New Jersey, USA",Multiple myeloma and leukaemia
Hubert Sumlin,80,80,"December 4, 2011",2011-12-04,"Wayne, New Jersey, USA",Heart failure
Dobie Gray,71,71,"December 6, 2011",2011-12-06,"Nashville, Tennessee, USA",Cancer
Sean Bonniwell The Music Machine,71,71,"December 20, 2011",2011-12-20,"Visalia, California, USA",Lung cancer
David Gold Woods of Ypres,31,31,"December 21, 2011",2011-12-21,"Barrie, Ontario, Canada",Car accident
Jim Sherwood The Mothers of Invention,69,69,"December 25, 2011",2011-12-25,,
Freddie Milano Dion And The Belmonts,72,72,"January 1, 2012",2012-01-01,"Massapequa, New York, USA",Respiratory failure
Larry Reinhardt Iron Butterfly Captain Beyond,63,63,"January 2, 2012",2012-01-02,"Bradenton, Florida, USA",Complications from sclerosis of the liver
Bob Weston Fleetwood Mac,64,64,"January 3, 2012",2012-01-03,"Brent Cross, London, England",Gastrointestinal hemorrhage
Nicole Bogner Visions of Atlantis,27,27,"January 5, 2012",2012-01-05,,Severe disease over a long period of time
"Robbie France Alphaville, Skunk Anansie",52,52,"January 14, 2012",2012-01-14,Spain,
"Jimmy Castor The Jimmy Castor Bunch, The Teenagers",71,71,"January 16, 2012",2012-01-16,"Henderson, Nevada, USA",Heart failure
Johnny Otis,90,90,"January 17, 2012",2012-01-17,"Los Angeles, California, USA",Natural causes
Etta James,73,73,"January 20, 2012",2012-01-20,"Riverside, California, USA",Leukemia
Don Cornelius Host of Soul Train,75,75,"February 1, 2012",2012-02-01,"Sherman Oaks, California, USA",Self-inflicted wound
Luis Alberto Spinetta Almendra Pescado Rabioso Invisible Spinetta Jade Spinetta y los Socios del Desierto,62,62,"February 8, 2012",2012-02-08,"Buenos Aires, Argentina",Lung cancer
Whitney Houston,48,48,"February 11, 2012",2012-02-11,"Los Angeles, California, USA",Drowned
"Tonmi Lillman Sinergy, To/Die/For, Lordi, Kylähullut",38,38,"February 13, 2012",2012-02-13,,
Dory Previn,86,86,"February 14, 2012",2012-02-14,"Southfield, Massachusetts, USA",Natural causes
"Michael Davis MC5, Destroy All Monsters",68,68,"February 17, 2012",2012-02-17,"Chico, California, USA",Liver failure
Billy Strange,81,81,"February 22, 2012",2012-02-22,"Franklin, Tennessee, USA",
Louisiana Red,79,79,"February 25, 2012",2012-02-25,"Hanover, Germany",Stroke
"Roland Bautista Earth, Wind & Fire",60,60,"February 29, 2012",2012-02-29,USA,Natural causes
Davy Jones The Monkees,66,66,"February 29, 2012",2012-02-29,"Indiantown, Florida, USA",Heart attack
Ronnie Montrose Montrose,64,64,"March 3, 2012",2012-03-03,"San Francisco Bay Area, USA",Suicide
Michael Hossack Doobie Brothers,65,65,"March 12, 2012",2012-03-12,"Dubois, Wyoming, USA",Cancer
Ken Lyons 38 Special,59,59,"March 20, 2012",2012-03-20,"Winston-Salem, North Carolina, USA",
Vince Lovegrove The Valentines,65,65,"March 24, 2012",2012-03-24,"Bangalow, New South Wales, Australia",Car accident
Jerry McCain,81,81,"March 28, 2012",2012-03-28,"Gadsden, Alabama, USA",
Jim Marshall Founder and owner of Marshall Amplification,88,88,"April 5, 2012",2012-04-05,"Milton Keynes, Buckinghamshire, England",Natural causes
Dick Clark Host of American Bandstand,82,82,"April 18, 2012",2012-04-18,"Santa Monica, California, USA",Heart attack
Levon Helm The Band,71,71,"April 19, 2012",2012-04-19,"New York City, New York, USA",Cancer
Greg Ham Men At Work,58,58,"April 19, 2012",2012-04-19,"Carlton North, Victoria, Australia",Heart attack
"Chris Etheridge International Submarine Band, The Flying Burrito Brothers",65,65,"April 23, 2012",2012-04-23,"Meridian, Mississippi, USA",
Tommy Marth The Killers,33,33,"April 23, 2012",2012-04-23,"Las Vegas, Nevada, USA",Suicide
Adam Yauch Beastie Boys,47,47,"May 4, 2012",2012-05-04,"Brooklyn, New York, USA",Parotid gland cancer
Rob Doherty Into Eternity,41,41,"May 5, 2012",2012-05-05,,
Michael Burks,54,54,"May 6, 2012",2012-05-06,"Atlanta, Georgia, USA",Heart Attack
"Donald ""Duck"" Dunn Booker T. & the M.G.'s",70,70,"May 13, 2012",2012-05-13,"Tokyo, Japan",Natural causes
Chuck Brown,75,75,"May 16, 2012",2012-05-16,"Baltimore, Maryland, USA",Multiple organ failure
Donna Summer,63,63,"May 17, 2012",2012-05-17,"Englewood, Florida, USA",Lung cancer
Robin Gibb Bee Gees,62,62,"May 20, 2012",2012-05-20,"Chelsea, London, England",Liver and kidney failure
John Harrison Hawkwind,69,69,"May 26, 2012",2012-05-26,"Los Angeles, California, USA",Huntington's disease
Doc Watson,89,89,"May 29, 2012",2012-05-29,"Winston-Salem, North Carolina, USA",Complications following colon surgery
Herb Reed The Platters,83,83,"June 4, 2012",2012-06-04,"Boston, Massachusetts, USA",Complications from heart disease
Bob Welch Fleetwood Mac,66,66,"June 7, 2012",2012-06-07,"Antioch, Tennessee, USA",Suicide
Brian Hibbard The Flying Pickets,65,65,"June 18, 2012",2012-06-18,"Cardiff, Wales",Prostate cancer
"Jon Lord Deep Purple, Whitesnake, Paice Ashton Lord, The Artwoods, The Flower Pot Men",71,71,"July 16, 2012",2012-07-16,"London, England",Pulmonary embolism
Larry Hoppen Orleans,61,61,"July 24, 2012",2012-07-24,,Disclosed causes
Tony Martin,98,98,"July 27, 2012",2012-07-27,"Los Angeles, California, USA",Natural causes
Tony Sly No Use for a Name,41,41,"July 31, 2012",2012-07-31,,Drug overdose
Jimmy Jones,75,75,"August 2, 2012",2012-08-02,"Aberdeen, North Carolina, USA",
Bob Birch,56,56,"August 15, 2012",2012-08-15,"Los Angeles, California, USA",Suicide by gunshot wound
Scott McKenzie,73,73,"August 19, 2012",2012-08-19,"Los Angeles, California, USA",Guillain–Barré syndrome
Joe South,72,72,"September 5, 2012",2012-09-05,"Buford, Georgia, USA",Heart failure
"James ""Sugar Boy"" Crawford",77,77,"September 15, 2012",2012-09-15,"New Orleans, Louisiana, USA",Brief illness
Patrick Saussois,58,58,"September 21, 2012",2012-09-21,"Paris, France",
Andy Williams The Williams Brothers,84,84,"September 25, 2012",2012-09-25,"Branson, Missouri, USA",Bladder cancer
R. B. Greaves,68,68,"September 27, 2012",2012-09-27,"Granada Hills, California, USA",Prostate cancer
Frank Wilson Record producer from Motown Records,74,74,"September 27, 2012",2012-09-27,,Prostate cancer
Berkant,73,73,"October 1, 2012",2012-10-01,"Istanbul, Turkey",Lung cancer
Big Jim Sullivan,71,71,"October 2, 2012",2012-10-02,"Billingshurst, West Sussex, England",Heart disease and diabetes
Kathi McDonald,64,64,"October 3, 2012",2012-10-03,"Seattle, Washington, USA",
Bill Dees,73,73,"October 24, 2012",2012-10-24,"Mountain Home, Arkansas, USA",
Natina Reed Blaque,31,31,"October 26, 2012",2012-10-26,"Duluth, Georgia, USA",Road accident
Terry Callier,67,67,"October 27, 2012",2012-10-27,"Chicago, Illinois, USA",Cancer
Mitch Lucker Suicide Silence,28,28,"November 1, 2012",2012-11-01,"Huntington Beach, California, USA",Motorcycle accident
Major Harris,65,65,"November 9, 2012",2012-11-09,"Richmond, Virginia, USA",Congestive heart and lung failure
Paul Frost The Rattlesnakes,64,64,"November 17, 2012",2012-11-17,England,Cancer
Michael Dunford Renaissance,68,68,"November 20, 2012",2012-11-20,"Surrey, England",Cerebral hemorrhage
"Earl Carroll The Cadillacs, The Coasters",75,75,"November 25, 2012",2012-11-25,"New York City, New York, USA",Compilations from a stroke and diabetes
Mickey Baker,87,87,"November 27, 2012",2012-11-27,"Toulouse, France",Heart and kidney failure
Dave Brubeck,91,91,"December 5, 2012",2012-12-05,"Norwalk, Connecticut, USA",Congestive heart failure
Ed Cassidy Spirit,89,89,"December 6, 2012",2012-12-06,"San Jose, California, USA",Cancer
"Huw Lloyd-Langton Hawkwind, Widowmaker",61,61,"December 6, 2012",2012-12-06,"Dorset, England",Cancer
Jimmy McCracklin,91,91,"December 20, 2012",2012-12-20,"San Pablo, California, USA",
Lee Dorman Iron Butterfly Captain Beyond,70,70,"December 21, 2012",2012-12-21,"Laguna Niguel, California, USA",Natural causes
Marva Whitney,68,68,"December 22, 2012",2012-12-22,"Kansas City, Kansas, USA",Pneumonia
"Mike Scaccia Ministry, Rigor Mortis, Revolting Cocks",47,47,"December 22, 2012",2012-12-22,"Fort Worth, Texas, USA",Heart attack
Fontella Bass,72,72,"December 26, 2012",2012-12-26,"St. Louis, Missouri, USA",Heart attack
Patti Page,85,85,"January 1, 2013",2013-01-01,"Encinitas, California, USA",Heart and lung disease
Sammy Johns,66,66,"January 4, 2013",2013-01-04,"Gastonia, North Carolina, USA",
Sam Page The Esquires,68,68,"January 7, 2013",2013-01-07,USA,
Trevor Gordon The Marbles,64,64,"January 10, 2013",2013-01-10,"London, England",Natural causes
Precious Bryant,71,71,"January 12, 2013",2013-01-12,"Columbus, Georgia, USA",Complications from diabetes and congestive heart failure
Claudio Leo Lacuna Coil,40,40,"January 17, 2013",2013-01-17,"Ceglie Messapica, Italy",
"Bobby Bennett The Famous Flames, Bobby Bennett & The Dynamics",74,74,"January 18, 2013",2013-01-18,"Maryland, USA",Complications from diabetes
"Steve Knight Mountain, The Devil's Anvil",77,77,"January 19, 2013",2013-01-19,"Riverdale, New York, USA",Parkinson's disease
Bob Engemann The Lettermen,77,77,"January 20, 2013",2013-01-20,,
"Leroy ""Sugarfoot"" Bonner Ohio Players",69,69,"January 26, 2013",2013-01-26,"Trotwood, Ohio, USA",Cancer
Kenny Hodges Spanky and Our Gang,76,76,"January 29, 2013",2013-01-29,"Papillion, Nebraska, USA",Viral pneumnoia
Mickey Finn Heavy Metal Kids,65,65,"February 1, 2013",2013-02-01,"Paris, France",Cancer
Donald Byrd,80,80,"February 4, 2013",2013-02-04,"Dover, Delaware, USA",
Reg Presley The Troggs,71,71,"February 4, 2013",2013-02-04,"Andover, Hampshire, England",Lung cancer
Tony Sheridan,72,72,"February 16, 2013",2013-02-16,"Hamburg, Germany",
Mindy McCready,37,37,"February 17, 2013",2013-02-17,"Heber Springs, Arkansas, USA",Shotgun wounds
Damon Harris The Temptations,62,62,"February 18, 2013",2013-02-18,"Baltimore, Maryland, USA",Prostate cancer
Kevin Ayers Soft Machine,68,68,"February 18, 2013",2013-02-18,"Montolieu, France",
Cleotha Staples The Staple Singers,78,78,"February 21, 2013",2013-02-21,"Chicago, Illinois, USA",Alzheimer's disease
Magic Slim,75,75,"February 21, 2013",2013-02-21,"Philadelphia, Pennsylvania, USA",Bleeding ulcers
"Dan Toler Great Southern, The Allman Brothers Band",64,64,"February 25, 2013",2013-02-25,"Manatee County, Florida, USA",Amyotrophic lateral sclerosis
Richard Street The Temptations,70,70,"February 27, 2013",2013-02-27,"Las Vegas, Nevada, USA",Pulmonary embolism
Jim Murray Quicksilver Messenger Service,70,70,"March 1, 2013",2013-03-01,,
Bobby Rogers The Miracles,73,73,"March 3, 2013",2013-03-03,"Southfield, Michigan, USA",Complications from diabetes
Alvin Lee Ten Years After,68,68,"March 6, 2013",2013-03-06,"Marbella, Spain",
Peter Banks Yes,65,65,"March 7, 2013",2013-03-07,"London, England",Heart failure
Clive Burr Iron Maiden,56,56,"March 12, 2013",2013-03-12,"London, England",Multiple sclerosis
Hardrock Gunter,88,88,"March 15, 2013",2013-03-15,,Complications of pneumonia
Jason Molina,39,39,"March 16, 2013",2013-03-16,"Indianapolis, Indiana, USA",Alcohol abuse-related organ failure
Bobby Smith The Spinners,76,76,"March 16, 2013",2013-03-16,"Orlando, Florida, USA",Complications of influenza and pneumonia
Floyd McRae The Chords,85,85,"March 19, 2013",2013-03-19,,
Deke Richards Motown record producer,68,68,"March 24, 2013",2013-03-24,"Bellingham, Washington, USA",Esophageal cancer
Phil Ramone Record engineer and record producer,79,79,"March 26, 2013",2013-03-26,"New York City, New York, USA",Aortic aneurysm
Dale Hyatt,87,87,"March 28, 2013",2013-03-28,,
"Chris Bailey The Angels, GANGgajang",62,62,"April 4, 2013",2013-04-04,"Sydney, Australia",Throat cancer
Andy Johns Sound engineer and record producer,62,62,"April 7, 2013",2013-04-07,"Los Angeles, California, USA",Stomach ulcer
Jimmy Dawkins,76,76,"April 10, 2013",2013-04-10,"Chicago, Illinois, USA",Undisclosed causes
"Don Blackman Twennynine, Parliament, Funkadelic, Earth, Wind & Fire",59,59,"April 11, 2013",2013-04-11,"New York City, New York, USA",Cancer
Sue Draheim,63,63,"April 11, 2013",2013-04-11,"Berea, Kentucky, USA",
Chi Cheng Deftones,42,42,"April 13, 2013",2013-04-13,"Sacramento, California, USA",Cardiac arrest
George Jackson,68,68,"April 14, 2013",2013-04-14,"Ridgeland, Mississippi, USA",Cancer
"Scott Miller Alternate Learning, Game Theory, The Loud Family",53,53,"April 15, 2013",2013-04-15,USA,
Chrissy Amphlett Divinyls,53,53,"April 21, 2013",2013-04-21,"New York City, New York, USA",Breast cancer
Richie Havens,72,72,"April 22, 2013",2013-04-22,"Jersey City, New Jersey, USA",Heart attack
Bob Brozman,59,59,"April 23, 2013",2013-04-23,"Ben Lomond, California, USA",Suicide
George Jones,81,81,"April 26, 2013",2013-04-26,"Nashville, Tennessee, USA",Hypoxic respiratory failure
Chris Kelly Kris Kross,34,34,"May 1, 2013",2013-05-01,"Atlanta, Georgia, USA",Drug Overdose
Jeff Hanneman Slayer,49,49,"May 2, 2013",2013-05-02,"Los Angeles, California, USA",Liver failure
Alan O'Day,72,72,"May 17, 2013",2013-05-17,"Westwood, California, USA",Brain cancer
Phil Buerstatte White Zombie,44,44,"May 20, 2013",2013-05-20,"Madison, Wisconsin, USA",
Ray Manzarek The Doors,74,74,"May 20, 2013",2013-05-20,"Rosenheim, Germany",Bile duct cancer
Trevor Bolder Uriah Heep,62,62,"May 21, 2013",2013-05-21,"Cottingham, East Riding of Yorkshire, England",Pancreatic cancer
"Clarence Burke, Jr. The Five Stairsteps",64,64,"May 26, 2013",2013-05-26,USA,
Little Tony,72,72,"May 27, 2013",2013-05-27,USA,
Marvin Junior The Dells,77,77,"May 29, 2013",2013-05-29,USA,
Zach Sobiech,18,18,"May 30, 2013",2013-05-30,"Lakeland, Saint Paul, Minnesota, USA",Complications from osteosarcoma
Shelbra Bennett The Soul Children,66,66,"May 31, 2013",2013-05-31,USA,
Rob Morsberger,53,53,"June 2, 2013",2013-06-02,"Hudson Valley, USA",
MickDeth Eighteen Visions Bleeding Through,35,35,"June 3, 2013",2013-06-03,"Salt Lake City, Utah, USA",Heart condition
"Joey Covington Hot Tuna, Jefferson Airplane",67,67,"June 4, 2013",2013-06-04,"Palm Springs, California, USA",Car accident
"Cornelius ""Nini"" Harp The Miracles",73,73,"June 4, 2013",2013-06-04,USA,
Jim Sundquist The Fendermen,75,75,"June 4, 2013",2013-06-04,,Cancer
Marshall Sewell The Edsels,75,75,"June 5, 2013",2013-06-05,,
Filip Topol Psí vojáci,48,48,"June 19, 2013",2013-06-19,"Prague, Czech Republic",
Paul Smith,91,91,"June 20, 2013",2013-06-20,"Torrance, California, USA",Heart failure
Mary Love,69,69,"June 21, 2013",2013-06-21,USA,
Bobby Bland,83,83,"June 23, 2013",2013-06-23,"Germantown, Tennessee, USA",
Little Willie Littlefield,81,81,"June 23, 2013",2013-06-23,"Voorthuizen, Netherlands, USA",Cancer
Alan Myers Devo,58,58,"June 24, 2013",2013-06-24,"Los Angeles, California, USA",Stomach cancer
Paul Giacalone The Fireflies,73,73,"June 27, 2013",2013-06-27,USA,
Texas Johnny Brown,85,85,"July 1, 2013",2013-07-01,"Houston, Texas, USA",Lung cancer
Brett Walker,51,51,"July 9, 2013",2013-07-09,"Draper, Utah, USA",
Cory Monteith Known from Glee,31,31,"July 13, 2013",2013-07-13,"Vancouver, British Columbia, Canada",Mixed drug toxicity
T-Model Ford,90,90,"July 16, 2013",2013-07-16,"Greenville, Mississippi, USA",Respiratory failure after a prolonged illness
Mikhail Gorsheniov Korol i Shut,39,39,"July 19, 2013",2013-07-19,"Saint Petersburg, Russia",Heart failure due to alcoholic cardiomyopathy
Faye Hunter Let's Active,59,59,"July 21, 2013",2013-07-21,USA,
Puff Johnson,40,40,"July 24, 2013",2013-07-24,,Cervical cancer
JJ Cale,74,74,"July 26, 2013",2013-07-26,"La Jolla, California, USA",Heart attack
Rita Reys,88,88,"July 28, 2013",2013-07-28,"Breukelen, The Netherlands, USA",Brian hemorrage
Tim Wright Pere Ubu,63,63,"August 4, 2013",2013-08-04,"Claveland, Ohio, USA",Cancer
George Duke,67,67,"August 5, 2013",2013-08-05,"Los Angeles, California, USA",Leukemia
James Grey Blue Rodeo,52,52,"August 5, 2013",2013-08-05,USA,
Allen Lanier Blue Öyster Cult,67,67,"August 14, 2013",2013-08-14,USA,Chronic obstructive pulmonary disease
Joey LaCaze Eyehategod,42,42,"August 23, 2013",2013-08-23,"New Orleans, Louisiana, USA",Respiratory failure
Joe Kelley The Shadows of Knight,67,67,"September 1, 2013",2013-09-01,,
Forrest,60,60,"September 6, 2013",2013-09-06,"Tilburg, Netherlands, USA",Stroke
Patti Webster,49,49,"September 13, 2013",2013-09-13,"Somerville, New Jersey, USA",Cancer
Mac Curtis,74,74,"September 15, 2013",2013-09-15,"Weatherford, Texas, USA",
Jimmy Ponder,67,67,"September 16, 2013",2013-09-16,"Pittsburgh, USA",
Billy Mure,97,97,"September 25, 2013",2013-09-25,,
"Keith ""Sabu"" Crier GQ",58,58,"September 30, 2013",2013-09-30,,
Jan Kuehnemund Vixen,51,51,"October 10, 2013",2013-10-10,"Colorado Springs, Colorado, USA",Cancer
Ronald Shannon Jackson Last Exit,73,73,"October 19, 2013",2013-10-19,"Fort Worth, Texas, USA",Leukemia
"Gypie Mayo Dr. Feelgood, The Yardbirds",62,62,"October 23, 2013",2013-10-23,,
Al Johnson The Unifics,65,65,"October 26, 2013",2013-10-26,USA,
Lou Reed Velvet Underground,71,71,"October 27, 2013",2013-10-27,"Long Island, USA",Liver disease
Pete Haycock Climax Blues Band,62,62,"October 30, 2013",2013-10-30,"Frankfurt, Germany",Heart attack
Bobby Parker,76,76,"October 31, 2013",2013-10-31,"Bowie, Maryland, USA",Heart attack
Oliver Cheatham,65,65,"November 29, 2013",2013-11-29,"Detroit, Michigan, USA",Heart attack
Dick Dodd The Standells,68,68,"November 29, 2013",2013-11-29,"Fountain Valley, California, USA",Cancer
Richard Coughlan Caravan,66,66,"December 1, 2013",2013-12-01,"Herne Bay, Kent, England",Pneumonia
Junior Murvin,67,67,"December 2, 2013",2013-12-02,"Port Antonio, Jamaica, USA",Diabetes
Gail Collins Pappalardi,72,72,"December 6, 2013",2013-12-06,"Ajijic Jalisco, Mexico",Cancer
Stan Tracey,86,86,"December 6, 2013",2013-12-06,,Cancer
Jim Hall,83,83,"December 10, 2013",2013-12-10,"New York City, New York, USA",
Ricky Lawson,59,59,"December 23, 2013",2013-12-23,"Long Beach, California, USA",Brain aneurysm
"Benjamin Curtis Tripping Daisy, Secret Machines, School of Seven Bells, UFOFU",35,35,"Decembver 29, 2013",2013-12-29,"New York City, New York, USA",T-cell lymphoblastic lymphoma
"Jay Traynor Jay and the Americans, The Tokens",70,70,"January 2, 2014",2014-01-02,"Tampa, Florida, USA",Liver cancer
Phil Everly Everly Brothers,74,74,"January 3, 2014",2014-01-03,"Burbank, California, USA",Lung disease
Maureen Gray,65,65,"January 7, 2014",2014-01-07,"Philadelphia, Pennsylvania, USA",Bile duct cancer
"Dennis Frederiksen Toto, Angel",62,62,"January 18, 2014",2014-01-18,"Mound, Minnesota, USA",Cancer
Pete Seeger,94,94,"January 27, 2014",2014-01-27,"Manhattan, New York City, New York, USA",Natural causes
The Mighty Hannibal,74,74,"January 30, 2014",2014-01-30,"The Bronx, New York, USA",
Anna Gordy Gaye,92,92,"January 31, 2014",2014-01-31,"Los Angeles, California, USA",
"Bunny Rugs Bunny & Ricky, Third World, Inner Circle",65,65,"February 2, 2014",2014-02-02,"Orlando, Florida, USA",
Bob Casale Devo,61,61,"February 17, 2014",2014-02-17,"Los Angeles, California, USA",Heart failure
Chip Damiani The Remains,68,68,"February 23, 2014",2014-02-23,USA,Brain hemorrhage
Franny Beecher Bill Haley & His Comets,92,92,"February 24, 2014",2014-02-24,"Philadelphia, Pennsylvania, USA",Natural Causes
Kelly Holland Cry of Love,52,52,"February 24, 2014",2014-02-24,USA,
Frank Reed The Chi-Lites,59,59,"February 26, 2014",2014-02-26,,Stroke
Charles Love Bloodstone,68,68,"March 6, 2014",2014-03-06,"Kansas City, Missouri, USA",Pneumonia
Jerry Corbitt The Youngbloods,71,71,"March 8, 2014",2014-03-08,"Smiley, Texas, USA",Lung cancer
"Buren Fowler Drivin' n' Cryin', R.E.M.",54,54,"March 8, 2014",2014-03-08,"Atlanta, Georgia, USA",Several health problems
Gary Burger The Monks,71,71,"March 14, 2014",2014-03-14,"Turtle River, Minnesota, USA",Pancreatic cancer
Scott Asheton The Stooges,64,64,"March 15, 2014",2014-03-15,"Ann Arbor, Michigan, USA",Heart attack
Joe Lala Co-founder of the Blues Image,66,66,"March 18, 2014",2014-03-18,"Tampa, Florida, USA",Lung cancer
Dave Brockie Gwar,50,50,"March 23, 2014",2014-03-23,"Richmond, Virginia, USA",Accidental heroin overdose.
Geoff Bradford,80,80,"March 23, 2014",2014-03-23,"Enfield, England",
Joe Frazier The Impalas,70,70,"April 1, 2014",2014-04-01,USA,
"Arthur ""Guitar Boogie"" Smith",93,93,"April 3, 2014",2014-04-03,"Charlotte, North Carolina, USA",
Jason McCash The Gates of Slumber,38,38,"April 5, 2014",2014-04-05,,
"George Shuffler The Stanley Brothers, The Bailey Brothers and the Happy Valley Boys",88,88,"April 7, 2014",2014-04-07,"Valdese, North Carolina, USA",
Little Joe Cook Little Joe & The Thrillers,91,91,"April 15, 2014",2014-04-15,"Framingham, Massachusetts, USA",Cancer
Shane Gibson Korn,35,35,"April 15, 2014",2014-04-15,"Birmingham, Alabama, USA",Blood clotting disorder
DJ E-Z Rock Rob Base and DJ E-Z Rock,46,46,"April 27, 2014",2014-04-27,"Manhattan, New York City, USA",Diabetic seizure
Paul Goddard Atlanta Rhythm Section,68,68,"April 29, 2014",2014-04-29,USA,
Larry Ramos The Association,72,72,"April 30, 2014",2014-04-30,"Clarkston, Washington, USA",Heart attack
"Jessica Cleaves The Friends of Distinction, Earth, Wind & Fire",65,65,"May 2, 2014",2014-05-02,"Los Angeles, California, USA",
Bobby Gregg,78,78,"May 3, 2014",2014-05-03,"Las Vegas, Nevada, USA",
"Ed Gagliardi Foreigner, Spys",62,62,"May 11, 2014",2014-05-11,USA,Cancer
Jerry Vale,83,83,"May 18, 2014",2014-05-18,"Palm Desert, California, USA",Natural causes
"Doc Neeson The Angels, Red Phoenix",67,67,"June 4, 2014",2014-06-04,"Sydney, Australia",Brain tumor
"Casey Kasem Host of Casey's Top 40, Casey's Top 20 & Casey's Countdown",82,82,"June 15, 2014",2014-06-15,"Gig Harbor, Washington, USA",Sepsis
