Name,Age,CleanAge,Date,CleanDate,Location,Cause of death
Denis Payton The Dave Clark Five,63,63,"December 17, 2006",2006-12-17,"Bournemouth, Dorset, England",Cancer
James Brown The Famous Flames The J.B.'s,73,73,"December 25, 2006",2006-12-25,"Atlanta, Georgia, USA",Pneumonia
Tad Jones,54,54,"January 1, 2007",2007-01-01,,Fall
Sneaky Pete Kleinow The Flying Burrito Brothers,72,72,"January 6, 2007",2007-01-06,"Petaluma, California, USA",Alzheimer's disease
"Brent Liles Social Distortion, Agent Orange",43,43,"January 18, 2007",2007-01-18,"Los Angeles, California, USA",Struck by road vehicle
Denny Doherty The Mamas & the Papas,66,66,"January 19, 2007",2007-01-19,"Mississauga, Ontario, Canada",Kidney failure
Billy Henderson The Spinners,67,67,"February 2, 2007",2007-02-02,USA,Cancer
Joe Hunter The Funk Brothers,79,79,"February 2, 2007",2007-02-02,"Detroit, Michigan, USA",
Barbara McNair,72,72,"February 4, 2007",2007-02-04,"Los Angeles, California, USA",Throat cancer
Eldee Young Young-Holt Unlimited,71,71,"February 12, 2007",2007-02-12,"Bangkok, Thailand",Heart attack
Charles Gocher Sun City Girls,54,54,"February 19, 2007",2007-02-19,"Seattle, Washington, USA",Cancer
Ian Wallace,60,60,"February 22, 2007",2007-02-22,"Los Angeles, California, USA",Esophageal cancer
Donnie Brooks,71,71,"February 23, 2007",2007-02-23,USA,Heart attack
Billy Thorpe,61,61,"February 28, 2007",2007-02-28,"Sydney, Australia",Myocardial infarction
Brad Delp Boston,55,55,"March 9, 2007",2007-03-09,"Atkinson, New Hampshire, USA",Suicide from carbon monoxide poisoning
Betty Hutton,86,86,"March 11, 2007",2007-03-11,"Palm Springs, California, USA",Colon cancer
Luther Ingram,69,69,"March 19, 2007",2007-03-19,"Belleville, Illinois, USA",Cardiovascular disease
Mark St. John Kiss,51,51,"April 5, 2007",2007-04-05,"New York City, New York, USA",Cerebral hemorrhage
Egon Bondy The Plastic People of the Universe,77,77,"April 9, 2007",2007-04-09,,
Dakota Staton,76,76,"April 10, 2007",2007-04-10,"New York, New York, USA",Stroke
Don Ho,76,76,"April 14, 2007",2007-04-14,"Waikiki, Hawaii, USA",Congestive heart failure
San Fadyl The Ladybug Transistor,31,31,"April 26, 2007",2007-04-26,USA,
Bobby Pickett The Crypt-Kickers,69,69,"April 27, 2007",2007-04-27,"Los Angeles, California, USA",Leukemia
Zola Taylor The Platters,69,69,"April 30, 2007",2007-04-30,"Los Angeles, California, USA",Pneumonia
Wolfgang Jäger Extrabreit,54,54,"May 3, 2007",2007-05-03,"Hagen, Germany",Illness
Big Joe Duskin,86,86,"May 6, 2007",2007-05-06,"Avondale, Ohio, USA",Diabetes
Carey Bell,70,70,"May 6, 2007",2007-05-06,"Chicago, Illinois, USA",Heart failure
Tony Thompson Hi-Five,31,31,"June 1, 2007",2007-06-01,"Waco, Texas, USA",Chlorodifluoromethane
John Pyke Ra Ra Riot,23,23,"June 2, 2007",2007-06-02,,
"Richard Bell The Band, Full Tilt Boogie Band",61,61,"June 15, 2007",2007-06-15,"Toronto, Ontario, Canada",
Hank Medress The Tokens,67,67,"June 18, 2007",2007-06-18,USA,Lung cancer
Natasja Saad,33,33,"June 24, 2007",2007-06-24,"Spanish Town, Jamaica, USA",Car accident
George McCorkle Marshall Tucker Band,59,59,"June 29, 2007",2007-06-29,"Lebanon, Tennessee, USA",
Bill Pinkney The Drifters,81,81,"July 4, 2007",2007-07-04,"Daytona Beach, Florida, USA",Heart attack
Kelly Johnson Girlschool,49,49,"July 15, 2007",2007-07-15,"Clapham, London, England",Spinal cancer
Ron Miller Record producer from Motown,74,74,"July 23, 2007",2007-07-23,USA,
Jon Lucien,65,65,"August 14, 2007",2007-08-14,"Orlando, Florida, USA",Respiratory failure
"Hilly Kristal Founder of CBGB, manager for The Dead Boys",75,75,"August 28, 2007",2007-08-28,"New York City, New York, USA",Lung cancer
Kip Anderson,69,69,"August 29, 2007",2007-08-29,"Anderson, South Carolina, USA",
Joe Zawinul Weather Report,75,75,"September 11, 2007",2007-09-11,"Vienna, Austria",Skin cancer
"Bobby Byrd The Famous Flames, The JB's",73,73,"September 12, 2007",2007-09-12,"Loganville, Georgia, USA",Cancer
Backwards Sam Firk,64,64,"October 11, 2007",2007-10-11,"Mill Spring, North Carolina, USA",Heart attack
Lucky Dube,43,43,"October 18, 2007",2007-10-18,"Rosettenville, Johannesburg Gauteng, South Africa",Murder
Paul Fox The Ruts,56,56,"October 21, 2007",2007-10-21,United Kingdom,Lung cancer
"Lance Hahn Cringer, J Church",40,40,"October 21, 2007",2007-10-21,"Austin, Texas, USA",Nephropathy complications
"John Petersen Harpers Bizarre, The Beau Brummels",65,65,"November 11, 2007",2007-11-11,,
Jim Ford,66,66,"November 18, 2007",2007-11-18,"Fort Bragg, California, USA",
Kevin DuBrow Quiet Riot,52,52,"November 19, 2007",2007-11-19,"Las Vegas, Nevada, USA",Accidental cocaine overdose
"Ernest ""Doc"" Paulin",100,100,"November 25, 2007",2007-11-25,"Marrero, Louisiana, USA",
Lynette Knackstedt Skankin' Pickle,37,37,"December 7, 2007",2007-12-07,"San Francisco, California, USA",Drug overdose
Ike Turner Kings of Rhythm Ike & Tina Turner,76,76,"December 12, 2007",2007-12-12,"San Marcos, California, USA",Cocaine overdose
Dan Fogelberg,56,56,"December 16, 2007",2007-12-16,"Deer Isle, Maine, USA",Prostate cancer
Oscar Peterson,82,82,"December 23, 2007",2007-12-23,"Mississauga, Ontario, Canada",
Dave Day The Monks,66,66,"January 10, 2008",2008-01-10,,Heart attack
John Stewart The Kingston Trio,68,68,"January 19, 2008",2008-01-19,"San Diego, California, USA",Brain aneurysm
Trevor Taylor Bad Boys Blue,50,50,"January 19, 2008",2008-01-19,"Cologne, Germany",Heart attack
Francis Clay,84,84,"January 21, 2008",2008-01-21,"San Francisco, California, USA",
Ben McMillan Gruntruck,46,46,"January 26, 2008",2008-01-26,USA,Diabetes
Scot Halpin The Who,54,54,"February 9, 2008",2008-02-09,"Bloomington, Indiana, USA",
Yegor Letov Grazhdanskaya Oborona,43,43,"February 19, 2008",2008-02-19,"Omsk, Russia",Cadriac arrest
Buddy Miles,60,60,"February 26, 2008",2008-02-26,"Austin, Texas, USA",Congestive heart failure
Mike Smith The Dave Clark Five,64,64,"February 28, 2008",2008-02-28,"Aylesbury, Buckinghamshire, England",Pneumonia
Mike Conley M.I.A.,49,49,"February 28, 2008",2008-02-28,"Chicago, Illinois, USA",Head injuries from falling
Jeff Healey The Jeff Healey Band,41,41,"March 2, 2008",2008-03-02,"Toronto, Ontario, Canada",Retinoblastoma
Norman Smith Record producer and audio engineer,85,85,"March 3, 2008",2008-03-03,"East Sussex, England",
Mikey Dread The Clash,53,53,"March 15, 2008",2008-03-15,"Stamford, Connecticut, USA",
"Klaus Dinger Kraftwerk, Neu!, La! Neu?",61,61,"March 21, 2008",2008-03-21,,Heart failure
Sean Levert LeVert,39,39,"March 30, 2008",2008-03-30,"Cleveland, Ohio, USA",Sarcoidosis
Larry Brown Harold Melvin & The Blue Notes,63,63,"April 6, 2008",2008-04-06,,
Sean Costello,28,28,"April 15, 2008",2008-04-15,"Atlanta, USA",
Brian Davison The Nice,65,65,"April 15, 2008",2008-04-15,United Kingdom,
Danny Federici Bruce Springsteen and the E-Street Band,58,58,"April 17, 2008",2008-04-17,"New York City, New York, USA",Melanoma
Al Wilson,68,68,"April 21, 2008",2008-04-21,"Fontana, California, USA",Kidney failure
Bob Childers,61,61,"April 22, 2008",2008-04-22,"Stillwater, Oklahoma, USA",Pneumonia and chronic obstructive pulmonary disease
Paul Davis,60,60,"April 22, 2008",2008-04-22,"Meridian, Mississippi, USA",Heart attack
"Micky Waller The Steampacket, The Jeff Beck Group",66,66,"May 8, 2008",2008-05-08,London,
John Rutsey Rush,55,55,"May 11, 2008",2008-05-11,"Toronto, Ontario, Canada",Diabetes
"Michelle Meldrum Phantom Blue, Meldrum",39,39,"May 21, 2008",2008-05-21,"Burbank, California, USA",Brain hemorrhage
Jimmy McGriff,72,72,"May 24, 2008",2008-05-24,"Voorhees Township, New Jersey, USA",Multiple sclerosis
Jerry Cole,68,68,"May 28, 2008",2008-05-28,"Corona, California, USA",Heart attack
Al Jones,62,62,"June 1, 2008",2008-06-01,United Kingdom,
Bo Diddley,79,79,"June 2, 2008",2008-06-02,"Archer, Florida, USA",Heart failure
"Mel Galley Whitesnake, Trapeze, Phenomena",60,60,"July 1, 2008",2008-07-01,"Cannock, England",Esophageal cancer
"Ulysses Kae Williams, Jr. Record producer from Pretty Poison",52,52,"July 11, 2008",2008-07-11,USA,
Jo Stafford,90,90,"July 16, 2008",2008-07-16,"Century City, California, USA",Congestive heart failure
Isaac Hayes,65,65,"August 10, 2008",2008-08-10,"Memphis, Tennessee, USA",Complications due to stroke
Jerry Wexler Music journalist Record producer,91,91,"August 15, 2008",2008-08-15,"Sarasota, Florida, USA",Congestive heart failure
Pervis Jackson The Spinners,70,70,"August 18, 2008",2008-08-18,,Cancer
Jerry Finn Record producer,39,39,"August 21, 2008",2008-08-21,"Los Angeles, California, USA",Cerebral hemorrhage
Richard Wright Pink Floyd,65,65,"September 15, 2008",2008-09-15,"London, England",Cancer
Earl Palmer,83,83,"September 19, 2008",2008-09-19,"Banning, California, USA",
Nappy Brown,78,78,"September 20, 2008",2008-09-20,"Charlotte, North Carolina, USA",Died in his sleep
Cherry Smith The Wailers,65,65,"September 204, 2008",2008-09-20,,
Nick Reynolds The Kingston Trio,75,75,"October 1, 2008",2008-10-01,"San Diego, California, USA",Acute respiratory disease
Gidget Gein Marilyn Manson,39,39,"October 8, 2008",2008-10-08,"Burbank, California, USA",Heroin overdose
Alton Ellis,70,70,"October 10, 2008",2008-10-10,"London, England",
Frankie Kerr Teenage Head,51,51,"October 15, 2008",2008-10-15,Canada,Cancer
Levi Stubbs The Four Tops,72,72,"October 17, 2008",2008-10-17,"Detroit, Michigan, USA",Natural causes
Dee Dee Warwick,66,66,"October 18, 2008",2008-10-18,"Essex County, New Jersey, USA",Nursing home
Virgil Gonsalves Pacific Gas & Electric,76,76,"October 20, 2008",2008-10-20,,
Mike Baker Shadow Gallery,45,45,"October 29, 2008",2008-10-29,,Heart attack
Frank Navetta Descendents,46,46,"October 31, 2008",2008-10-31,,
"Jimmy Carl Black The Mothers of Invention, Muffin Men, Captain Beefheart",70,70,"November 1, 2008",2008-11-01,"Siegsdorf, Germany",Lung cancer
Jody Reynolds The Storms,75,75,"November 7, 2008",2008-11-07,"Palm Desert, California, USA",Liver cancer
Mitch Mitchell The Jimi Hendrix Experience,62,62,"November 12, 2008",2008-11-12,"Portland, Oregon, USA",Natural causes
Richey Edwards Manic Street Preachers,27 (at time of disappearance),27,"Went missing c. February 1, 1995 Presumed dead November 23, 2008",1995-02-01,"Last seen near Aust, England",
Munetaka Higuchi Loudness,49,49,"November 30, 2008",2008-11-30,"Osaka, Japan",Hepatocellular carcinoma
Chico Banks,46,46,"December 3, 2008",2008-12-03,"Chicago, Illinois, USA",Faulty heart valve
Steve Isham Autograph,56,56,"December 9, 2008",2008-12-09,USA,
Dennis Yost Classics IV,65,65,"December 9, 2008",2008-12-09,,
Sandeé Exposé,46,46,"December 15, 2008",2008-12-15,"Hollywood, Florida, USA",Seizure
Feliciano Vierra Tavares Tavares,88,88,"December 17, 2008",2008-12-17,"Hyannis, Massachusetts, USA",Prostate cancer
Robert Ward,70,70,"December 25, 2008",2008-12-25,"Dry Branch, Georgia, USA",Died at home
Ron Asheton The Stooges,60,60,"January 6, 2009",2009-01-06,"Ann Arbor, Michigan, USA",Heart attack
Andy DeMize Nekromantix,25,25,"January 11, 2009",2009-01-11,"Fullerton, California, USA",Car accident
"David ""Fathead"" Newman",75,75,"January 20, 2009",2009-01-20,"Kingston, New York, USA",Complications of pancreatic cancer
Billy Powell Lynyrd Skynyrd,56,56,"January 28, 2009",2009-01-28,"Orange Park, Florida, USA",Heart attack
Hank Crawford,74,74,"January 29, 2009",2009-01-29,USA,
Dewey Martin Buffalo Springfield,68,68,"January 31, 2009",2009-01-31,"Van Nuys, California, USA",Natural causes
Lux Interior The Cramps,62,62,"February 4, 2009",2009-02-04,"Glendale, California, USA",Aortic dissection
Estelle Bennett The Ronettes,67,67,"February 11, 2009",2009-02-11,"Englewood, New Jersey, USA",Colon cancer
Miika Tenkula Sentenced,34,34,"February 18, 2009",2009-02-18,"Muhos, Finland",Heart attack
Snooks Eaglin,73,73,"February 18, 2009",2009-02-18,"New Orleans, Louisiana, USA",Heart attack
Kelly Groucutt Electric Light Orchestra,63,63,"February 19, 2009",2009-02-19,"Worcester, England",Heart attack
Jimmy Boyd,70,70,"March 7, 2009",2009-03-07,"Santa Monica, California, USA",Cancer
"Kent Henry Blues Image, Steppenwolf",60,60,"March 18, 2009",2009-03-18,"Portland, Oregon, USA",Alzheimer's disease
Mel Brown,69,69,"March 20, 2009",2009-03-20,"Kitchener, Ontario, Canada",Complications from emphysema
Uriel Jones The Funk Brothers,74,74,"March 24, 2009",2009-03-24,"Dearborn, Michigan, USA",Heart attack
Dan Seals England Dan and John Ford Coley,61,61,"March 25, 2009",2009-03-25,"Nashville, Tennessee, USA",Mantle cell lymphoma
John Mayhew Genesis,61,61,"March 26, 2009",2009-03-26,"Glasgow, Scotland",Heart condition
Nancy Overton The Chordettes,83,83,"April 5, 2009",2009-04-05,"Blairstown, New Jersey, USA",Esophageal cancer
Tam Paton Bay City Rollers,70,70,"April 8, 2009",2009-04-08,,Heart attack
Rocky Hill Dusty Hill's oldest brother and association of American Blues,62,62,"April 10, 2009",2009-04-10,"Houston, Texas, USA",
Betty Hall Jones,98,98,"April 20, 2009",2009-04-20,USA,
Uli Trepte Guru Guru,68,68,"May 21, 2009",2009-05-21,"Berlin, Germany",Cancer
Koko Taylor,80,80,"June 3, 2009",2009-06-03,"Kildeer, Illinois, USA",
Bob Bogle The Ventures,75,75,"June 14, 2009",2009-06-14,"Vancouver, Washington, USA",Non-Hodgkin lymphoma
Sky Saxon The Seeds,71,71,"June 25, 2009",2009-06-25,"Austin, Texas, USA",Heart and kidney failure due to infection
Michael Jackson The Jackson 5,50,50,"June 25, 2009",2009-06-25,"Los Angeles, California, USA",Cardiac arrest
George William Fullerton,86,86,"July 4, 2009",2009-07-04,"Fullerton, California, USA",
Midnight Crimson Glory,47,47,"July 8, 2009",2009-07-08,"St. Petersburg, Florida, USA",Stomach aneurysm
Gordon Waller Peter and Gordon,64,64,"July 17, 2009",2009-07-17,"Ledyard, Connecticut, USA",Cardiac arrest
Marcel Jacob Talisman,45,45,"July 21, 2009",2009-07-21,"Stockholm, Sweden",Suicide
Andy Parle Space,42,42,"August 1, 2009",2009-08-01,"Liverpool, England","Fell while crossing the road on Dingle, Liverpool"
Mike Seeger,75,75,"August 7, 2009",2009-08-07,"Lexington, Virginia, USA",Cancer
Rashied Ali,76,76,"August 12, 2009",2009-08-12,"New York City, New York, USA",
Les Paul,94,94,"August 13, 2009",2009-08-13,"White Plains, New York, USA",Pneumonia
Larry Knechtel Bread,69,69,"August 20, 2009",2009-08-20,"Yakima, Washington, USA",Cardiac arrest
"Johnny Carter The Flamingos, The Dells",75,75,"August 21, 2009",2009-08-21,"Harvey, Illinois, USA",Natural causes
Ellie Greenwich,68,68,"August 26, 2009",2009-08-26,"New York City, New York, USA",Heart attack
Jake Drake-Brockman Echo & the Bunnymen,53,53,"September 1, 2009",2009-09-01,"Isle of Man, USA",
Guy Babylon,52,52,"September 2, 2009",2009-09-02,,Heart attack
Jim Carroll,60,60,"September 11, 2009",2009-09-11,"New York City, New York, USA",Heart attack
"Mary Travers Peter, Paul And Mary",72,72,"September 16, 2009",2009-09-16,"Danbury, Connecticut, USA",Complications arising from chemotherapy
Sam Carr The Jelly Roll Kings,83,83,"September 21, 2009",2009-09-21,"Clarksdale, Mississippi, USA",Congestive heart failure
Dickie Peterson Blue Cheer,61,61,"October 12, 2009",2009-10-12,Germany,Liver cancer
"Brendan Mullen Music promoter, founder of Los Angeles punk rock club The Masque",60,60,"October 12, 2009",2009-10-12,"Los Angeles, California, USA",Stroke
Sirone,69,69,"October 21, 2009",2009-10-21,USA,
Chris Bartley,62,62,"October 26, 2009",2009-10-26,,Kidney failure
Norton Buffalo The Steve Miller Band,58,58,"October 30, 2009",2009-10-30,"Paradise, California, USA",Lung cancer
Haydain Neale Jacksoul,39,39,"November 22, 2009",2009-11-22,"Toronto, Ontario, Canada",Lung cancer
Al Alberts The Four Aces,87,87,"November 27, 2009",2009-11-27,"Arcadia, Florida, USA",Natural causes
Eric Woolfson The Alan Parsons Project,64,64,"December 2, 2009",2009-12-02,"London, England",Cancer
Jack Rose Pelt,38,38,"December 5, 2009",2009-12-05,"Bala Cynwyd, Pennsylvania, USA",Heart attack
James Gurley Big Brother and the Holding Company,69,69,"December 20, 2009",2009-12-20,"Palm Desert, California, USA",Heart attack
Mick Cocks Rose Tattoo,54,54,"December 22, 2009",2009-12-22,"Sydney, Australia",Liver cancer
Vic Chesnutt,45,45,"December 25, 2009",2009-12-25,"Athens, Georgia, USA",Suicide or accidental drug overdose related to a permanent illness (quadriplegia)
Tony Bellamy Redbone,63,63,"December 25, 2009",2009-12-25,"Las Vegas, Nevada, USA",Liver failure
"The Rev Avenged Sevenfold, Pinkly Smooth, Suburban Legends",28,28,"December 28, 2009",2009-12-28,"Huntington Beach, California, USA",Effects of mixed drugs
Rowland S. Howard The Birthday Party,50,50,"December 30, 2009",2009-12-30,"Heidelberg, Victoria, Australia",Liver cancer
Gregory Slay Remy Zero,40,40,"January 1, 2010",2010-01-01,"Bodega Bay, California, USA",Cystic fibrosis
Willie Mitchell,81,81,"January 5, 2010",2010-01-05,"Memphis, Tennessee, USA",Cardiac arrest
Mick Green Johnny Kidd & The Pirates,65,65,"January 11, 2010",2010-01-11,"Ilford, Essex, England",Heart failure
Brian Damage The Misfits,46,46,"January 12, 2010",2010-01-12,"Los Angeles, California, USA",Liver cancer
Yabby You,63,63,"January 12, 2010",2010-01-12,"Clarendon Parish, Jamaica",Brain aneurysm
Jay Reatard Lost Sounds,29,29,"January 13, 2010",2010-01-13,"Memphis, Tennessee, USA",Cocaine and alcohol toxicity
Teddy Pendergrass Harold Melvin & The Blue Notes,59,59,"January 13, 2010",2010-01-13,"Bryn Mawr, Pennsylvania, USA",Illness related to his paralysis condition
Bobby Charles,71,71,"January 14, 2010",2010-01-14,"Abbeville, Louisiana, USA",Natural causes
Kate McGarrigle,63,63,"January 18, 2010",2010-01-18,"St. Johns, Newfoundland, Canada",Cancer
"Robert ""Squirrel"" Lester The Chi-Lites",67,67,"January 22, 2010",2010-01-22,"Chicago, Illinois, USA",Liver cancer
Mallia Franklin Parliament,57,57,"February 5, 2010",2010-02-05,USA,
Richard Delvy The Bel-Airs The Challengers,67,67,"February 6, 2010",2010-02-06,"West Hills, California, USA",Complications from an illness
Dale Hawkins,73,73,"February 13, 2010",2010-02-13,"Little Rock, Arkansas, USA",Colon cancer
Doug Fieger The Knack,57,57,"February 14, 2010",2010-02-14,"Woodland Hills, California, USA",Cancer
Tom Wolk,58,58,"February 28, 2010",2010-02-28,"Pawling, New York, USA",Heart attack
Lolly Vegas Redbone,70,70,"March 4, 2010",2010-03-04,"Los Angeles, California, USA",Lung cancer
Mark Linkous Sparklehorse,48,48,"March 6, 2010",2010-03-06,"Knoxville, Tennessee, USA",Suicide by gunshot
"Alex Chilton The Box Tops, Big Star",59,59,"March 17, 2010",2010-03-17,"New Orleans, Louisiana, USA",Heart attack
"Johnny Maestro Johnny Maestro & the Brooklyn Bridge, The Crests",70,70,"March 24, 2010",2010-03-24,"Cape Coral, Florida, USA",Cancer
Jim Marshall Rock and roll photographer,74,74,"March 24, 2010",2010-03-24,"New York City, New York, USA",Died in sleep
Jerry Byrne,69,69,"April 7, 2010",2010-04-07,"Morgan City, Louisiana, USA",Lung cancer
Eddie Johnson,89,89,"April 7, 2010",2010-04-07,,
Malcolm McLaren Manager for Sex Pistols,64,64,"April 8, 2010",2010-04-08,"New York City, New York, USA",Mesothelioma
"Peter Steele Type O Negative, Carnivore",48,48,"April 14, 2010",2010-04-14,"Brooklyn, New York, USA",Heart failure
Owsley,44,44,"April 30, 2010",2010-04-30,"Franklin, Tennessee, USA",Suicide
"Ronnie James Dio Dio, Black Sabbath, Rainbow, Elf",67,67,"May 16, 2010",2010-05-16,"Houston, Texas, USA",Stomach cancer
Hank Jones,91,91,"May 16, 2010",2010-05-16,"The Bronx, New York, USA",
Paul Gray Slipknot,38,38,"May 24, 2010",2010-05-24,"Urbandale, Iowa, USA",Accidental morphine and fentanyl overdose
Ali-Ollie Woodson,58,58,"May 30, 2010",2010-05-30,"Los Angeles, California, USA",Battling with leukemia
Marvin Isley The Isley Brothers,56,56,"June 6, 2010",2010-06-06,"Chicago, Illinois, USA",Complications due to diabetes
Calvin Leavy,70,70,"June 6, 2010",2010-06-06,"Pine Bluff, Arkansas, USA",
"Walt Woodward III Twisted Sister, Shark Island, The Painkillers, Sweet Savage",51,51,"June 8, 2010",2010-06-08,,Alcohol poisoning
Harold Ivory Williams,60,60,"June 9, 2010",2010-06-09,USA,
Garry Shider Parliament-Funkadelic,56,56,"June 14, 2010",2010-06-14,"Greater Upper Marlboro, Maryland, USA",Lung cancer
Peter Quaife The Kinks,66,66,"June 23, 2010",2010-06-23,Denmark,Kidney failure
Harvey Fuqua The Moonglows,80,80,"July 6, 2010",2010-07-06,"Detroit, Michigan, USA",Heart failure
Sugar Minott,54,54,"July 10, 2010",2010-07-10,"Saint Andrew Parish, Jamaica",
Andy Hummel Big Star,59,59,"July 19, 2010",2010-07-19,"Weatherford, Texas, USA",Cancer
Phillip Walker,73,73,"July 22, 2010",2010-07-22,USA,Heart failure
"Al Goodman Ray, Goodman & Brown",67,67,"July 26, 2010",2010-07-26,USA,Heart Failure
Derf Scratch Fear,59,59,"July 28, 2010",2010-07-28,"Camarillo, California, USA",Liver disease
Mitch Miller,99,99,"July 31, 2010",2010-07-31,"New York, New York, USA",Short illness
Bobby Hebb,72,72,"August 3, 2010",2010-08-03,"Nashville, Tennessee, USA",Lung cancer
Catfish Collins Parliament-Funkadelic,66,66,"August 6, 2010",2010-08-06,"Cincinnati, Ohio, USA",Cancer
Abbey Lincoln,80,80,"August 14, 2010",2010-08-14,"New York, New York, USA",
Kenny Edwards The Stone Poneys,64,64,"August 18, 2010",2010-08-18,"Santa Barbara, California, USA",Prostate cancer
Michael Been The Call,60,60,"August 19, 2010",2010-08-19,"Hasselt, Belgium",Heart attack
Charles Haddon Ou Est le Swimming Pool,22,22,"August 20, 2010",2010-08-20,"Pukkelpop, Belgium",Suicide from a fall
Mike Edwards Electric Light Orchestra,62,62,"September 3, 2010",2010-09-03,"Halwell, Devon, England",Car accident
Rich Cronin LFO,36,36,"September 8, 2010",2010-09-08,"Boston, Massachusetts, USA",Leukemia
John Hansen The Slickee Boys,47,47,"September 17, 2010",2010-09-17,,Suicide
Chris Rybicki Unearth,39,39,"September 20, 2010",2010-09-20,USA,Car accident
Eddie Fisher,82,82,"September 22, 2010",2010-09-22,"Berkeley, California, USA",Complications from hip surgery
Dick Griffey Founder of SOLAR Records,72,72,"September 24, 2010",2010-09-24,"Canoga Park, Los Angeles, California, USA",Complications from coronary artery bypass surgery
Steve Lee Gotthard,47,47,"October 5, 2010",2010-10-05,"Mesquite, Nevada, USA",Motorbike accident
Solomon Burke,70,70,"October 10, 2010",2010-10-10,"Badhoevedorp, Netherlands",Heart attack
"General Johnson Chairmen of the Board, The Showmen",69,69,"October 13, 2010",2010-10-13,"Atlanta, USA",Lung cancer
Ari Up The Slits,48,48,"October 20, 2010",2010-10-20,"Los Angeles, California, USA",Cancer
Denis Simpson The Nylons,59,59,"October 22, 2010",2010-10-22,"Peterborough, Ontario, Canada",Brain hemorrhage
Gregory Isaacs,59,59,"October 25, 2010",2010-10-25,"London, England",Lung cancer
John King Steve Miller Band,63,63,"October 26, 2010",2010-10-26,"Kingsport, Tennessee, USA",
"Jim Clench April Wine, Loverboy, Bachman–Turner Overdrive",61,61,"November 3, 2010",2010-11-03,"Montreal, Quebec, Canada",Lung Cancer
J.P. Toulon Old Skull,31,31,"November 11, 2010",2010-11-11,,Overdose
Woolly Wolstenholme Barclay James Harvest,63,63,"December 13, 2010",2010-12-13,,Suicide
Captain Beefheart Captain Beefheart and the Magic Band,69,69,"December 17, 2010",2010-12-17,"Glendale, California, USA",Complications from multiple sclerosis
Teena Marie,54,54,"December 26, 2010",2010-12-26,"Pasadena, California, USA",Epileptic seizure
Mick Karn Japan,52,52,"January 4, 2011",2011-01-04,"Chelsea, London, England",Cancer
Gerry Rafferty Stealers Wheel,63,63,"January 4, 2011",2011-01-04,"Bournemouth, Dorset, England",Liver failure
Phil Kennemore Y&T,57,57,"January 7, 2011",2011-01-07,"California, USA",Lung cancer
Steve Mancha,65,65,"January 8, 2011",2011-01-08,"Detroit, Michigan, USA",
Alex Kirst The Nymphs,47,47,"January 13, 2011",2011-01-13,"Cathedral City, California, USA",Car accident
Trish Keenan Broadcast,42,42,"January 14, 2011",2011-01-14,"Birmingham, England",Pneumonia
"Steve Prestwich Cold Chisel, Little River Band",56,56,"January 16, 2011",2011-01-16,,Brain tumor
Don Kirshner Producer of The Monkees,76,76,"January 17, 2011",2011-01-17,"Boca Raton, Florida, USA",Heart failure
Gladys Horton The Marvelettes,65,65,"January 26, 2011",2011-01-26,"Sherman Oaks, California, USA",Stroke
"Mark Ryan The Moors Murderers, Adam and the Ants",51,51,January 31. 2011,2011-01-31,"Cardiff, Wales, England",Complication
"Gary Moore Thin Lizzy, Colosseum II",58,58,"February 6, 2011",2011-02-06,"Estepona, Málaga, Spain",Heart attack
Mark Tulin The Electric Prunes,62,62,"February 26, 2011",2011-02-26,"Avalon, California, USA",
Eddie Kirkland,87,87,"February 28, 2011",2011-02-28,"Crystal River, Florida, USA",Car accident
Johnny Preston,71,71,"March 4, 2011",2011-03-04,"Beaumont, Texas, USA",Heart failure
Mike Starr Alice in Chains,44,44,"March 8, 2011",2011-03-08,"Salt Lake City, Utah, USA",Prescription drug overdose
Big Jack Johnson,70,70,"March 14, 2011",2011-03-14,"Memphis, Tennessee, USA",Disclosing illness
Melvin Sparks,64,64,"March 15, 2011",2011-03-15,"Mount Vernon, New York, USA",Diabetes and a high blood pressure
Jet Harris The Shadows,71,71,"March 18, 2011",2011-03-18,"Winchester, England",
Loleatta Holloway,64,64,"March 21, 2011",2011-03-21,"Los Angeles, California, USA",
Pinetop Perkins,97,97,"March 21, 2011",2011-03-21,"Austin, Texas, USA",
Frankie Sparcello Exhorder,44,44,"March 22, 2011",2011-03-22,"New Orleans, Louisiana, USA",
Zoogz Rift,57,57,"March 22, 2011",2011-03-22,,Complications due to diabetes
Henke Frykman Disfear,40,40,"March 25, 2011",2011-03-25,Sweden,Cancer
Calvin Russell,62,62,"April 3, 2011",2011-04-03,"Garfield, Texas, USA",Liver cancer
Scott Columbus Manowar,54,54,"April 4, 2011",2011-04-04,,
Poly Styrene X-Ray Spex,53,53,"April 25, 2011",2011-04-25,USA,Breast cancer
Phoebe Snow,60,60,"April 26, 2011",2011-04-26,"Edison, New Jersey, USA",Cerebral hemorrhage
