Name,Age,CleanAge,Date,CleanDate,Location,Cause of death
Kansas Joe McCoy Harlem Hamfats,44,44,"January 28, 1950",1950-01-28,"Chicago, Illinois, USA",Heart disease
Bertha Hill,45,45,"May 7, 1950",1950-05-07,"New York City, New York, USA",
Papa Charlie McCoy Harlem Hamfats,41,41,"July 26, 1950",1950-07-26,"Chicago, Illinois, USA",Paralytic brain disease
Cecil Gant,37,37,"February 4, 1951",1951-02-04,"Nashville, Tennessee, USA",Pneumonia and heart attack
Luke Jordan,60,60,"June 25, 1952",1952-06-25,,
Hank Williams,29,29,"January 1, 1953",1953-01-01,"Oak Hill, West Virginia, USA",Heart attack
Willie Love,46,46,"August 19, 1953",1953-08-19,"Jackson, Mississippi, USA",Bronchopneumonia
Carolina Slim,30,30,"October 22, 1953",1953-10-22,"Newark, New York, USA",Heart attack
Danny Cedrone Bill Haley & His Comets,33,33,"June 17, 1954",1954-06-17,"Philadelphia, Pennsylvania, USA",Broken neck from falling down stairs
Hot Lips Page,46,46,"November 9, 1954",1954-11-09,"New York, USA",Heart attack
Dink Johnson,62,62,"November 29, 1954",1954-11-29,USA,
Papa Celestin,70,70,"December 15, 1954",1954-12-15,"New Orleans, Louisiana, USA",
Johnny Ace,25,25,"December 25, 1954",1954-12-25,"Houston, Texas, USA",Accidental shooting
Ralph Willis,47,47,"June 11, 1957",1957-06-11,"New York City, New York, USA",
W. C. Handy,84,84,"March 28, 1958",1958-03-28,"New York City, New York, USA",Bronchial pneumonia
Chuck Willis,32-30,31,"April 10, 1958",1958-04-10,"Atlanta, Georgia, USA",Peritonitis
Big Bill Broonzy,65,65,August 14. 1958,1958-08-14,"Chicago, Illinois, USA",Laryngeal cancer
"Henry ""Son"" Sims",68,68,"December 26, 1958",1958-12-26,"Memphis, Tennessee, USA",Renal surgery
Buddy Holly Buddy Holly & The Crickets,22,22,"February 3, 1959",1959-02-03,"Clear Lake, Iowa, USA",Plane accident
The Big Bopper,28,28,"February 3, 1959",1959-02-03,"Clear Lake, Iowa, USA",Plane accident
Ritchie Valens,17,17,"February 3, 1959",1959-02-03,"Clear Lake, Iowa, USA",Plane accident
Guitar Slim,32,32,"February 7, 1959",1959-02-07,"New York City, New York, USA",Pneumonia
Jesse Belvin,27,27,"February 6, 1960",1960-02-06,"Fairhope, Arkansas, USA",Car accident
Eddie Cochran,21,21,"April 17, 1960",1960-04-17,"Chippenham, Wiltshire, England",Car accident
Smokey Hogg,46,46,"May 1, 1960",1960-05-01,"McKinney, Texas, USA",Cancer
Johnny Horton,35,35,"November 5, 1960",1960-11-05,"Milano, Texas, USA",Car accident
Stick McGhee,43,43,"August 15, 1961",1961-08-15,"The Bronx, New York, USA",Lung cancer
Stuart Sutcliffe The Beatles,21,21,"April 10, 1962",1962-04-10,"Hamburg, West Germany",Cerebral hemorrhage
Elmore James,45,45,"May 24, 1963",1963-05-24,"Chicago, Illinois, USA",Heart attack
Dinah Washington,39,39,"December 14, 1963",1963-12-14,"Detroit, Michigan, USA",Accidental overdose
Cyril Davies,31,31,"January 7, 1964",1964-01-07,"London, England",Endocarditis and leukaemia
Rudy Lewis The Drifters,27,27,"May 20, 1964",1964-05-20,"New York City, New York, USA",Choked to death in his sleep
Eric Dolphy,36,36,"June 29, 1964",1964-06-29,"Berlin, Germany",
Johnny Burnette The Rock and Roll Trio,30,30,"August 14, 1964",1964-08-14,"Clear Lake, California, USA",Drowning
Tiny Topsy,34,34,"August 16, 1964",1964-08-16,"Chicago, Illinois, USA",Intracerebral hemorrhage
Joe Henderson,27,27,"October 24, 1964",1964-10-24,"Nashville, Tennessee, USA",Heart attack
Sam Cooke,33,33,"December 11, 1964",1964-12-11,"Los Angeles, California, USA",Shot to death by motel manager Bertha Franklin
Alan Freed,43,43,"January 20, 1965",1965-01-20,"Palm Springs, California, USA",Uremia and liver cirrhosis
Nat King Cole,45,45,"February 15, 1965",1965-02-15,"Santa Monica, California, USA",Lung Cancer
Sonny Boy Williamson II,52,52,"May 25, 1965",1965-05-25,"Helena, Arkansas, USA",Heart attack
Bill Black,39,39,"October 21, 1965",1965-10-21,"Memphis, Tennessee, USA",Brain tumor
Richard Fariña,29,29,"April 30, 1966",1966-04-30,"Carmel Valley, California, USA",Motorcycle accident
Bobby Fuller The Bobby Fuller Four,23,23,"July 18, 1966",1966-07-18,"Los Angeles, California, USA",Suicide (suspicious)
Johnny Kidd Johnny Kidd & The Pirates,30,30,"October 7, 1966",1966-10-07,"Bury, Lancashire, England",Car accident
Smiley Lewis,53,53,"October 7, 1966",1966-10-07,"New Orleans, Louisiana, USA",Stomach cancer
Mississippi John Hurt,73-74,73,"November 2, 1966",1966-11-02,"Grenada, Mississippi, USA",Heart attack
Moon Mullican,57,57,"January 1, 1967",1967-01-01,"Beaumont, Texas, USA",
Joe Meek,37,37,"February 3, 1967",1967-02-03,"London, England",Suicide by gunshot
Brian Epstein Manager of The Beatles,32,32,"August 27, 1967",1967-08-27,"London, England",Accidental carbitral overdose
Woody Guthrie,55,55,"October 3, 1967",1967-10-03,"New York City, New York, USA",Huntington's disease
Peter Bocage,80,80,"December 3, 1967",1967-12-03,"New Orleans, Louisiana, USA",
Otis Redding,26,26,"December 10, 1967",1967-12-10,"Madison, Wisconsin, USA",Plane accident
Jimmie King Ronnie Caldwell Carl Cunningham Phalon Jones The Bar-Kays,,18,"December 10, 1967",1967-12-10,"Madison, Wisconsin, USA",Plane accident
Jimmie King Ronnie Caldwell Carl Cunningham Phalon Jones The Bar-Kays,,18,"December 10, 1967",1967-12-10,"Madison, Wisconsin, USA",Plane accident
Jimmie King Ronnie Caldwell Carl Cunningham Phalon Jones The Bar-Kays,Various (18-19),19,"December 10, 1967",1967-12-10,"Madison, Wisconsin, USA",Plane accident
Jimmie King Ronnie Caldwell Carl Cunningham Phalon Jones The Bar-Kays,,19,"December 10, 1967",1967-12-10,"Madison, Wisconsin, USA",Plane accident
"""Rockin' Robin"" Roberts The Wailers",27,27,"December 22, 1967",1967-12-22,"San Mateo County, California, USA",Car accident
Bert Berns,38,38,"December 30, 1967",1967-12-30,"New York City, New York, USA",Heart failure
Little Walter,37,37,"February 15, 1968",1968-02-15,"Chicago, Illinois, USA",Coronary thrombosis due to injuries sustained while fighting
Frankie Lymon Frankie Lymon and the Teenagers,25,25,"February 27, 1968",1968-02-27,"New York City, New York, USA",Heroin overdose
"Syd Nathan Record producer, music business executive and co-founder of King Records",63,63,"March 5, 1968",1968-03-05,"Miami Beach, Florida, USA",Pneumonia
Lester Melrose,76,76,"April 12, 1968",1968-04-12,"Lake, Florida, USA",
Little Willie John,30,30,"May 26, 1968",1968-05-26,"Walla Walla, Washington, USA",Heart attack in prison for manslaughter
Bumble Bee Slim,63,63,"June 8, 1968",1968-06-08,"Los Angeles, California, USA",
Wes Montgomery,45,45,"June 15, 1968",1968-06-15,"Indianapolis, Indiana, USA",Heart attack
Joe Hinton,38,38,"August 13, 1968",1968-08-13,"Boston, Massachusetts, USA",Skin cancer
Red Foley,58,58,"September 19, 1968",1968-09-19,"Fort Wayne, Indiana, USA",Respiratory Failure
Malcolm Hale Spanky and Our Gang,27,27,"October 30, 1968",1968-10-30,"Chicago, Illinois, USA",Accidental carbon monoxide poisoning
Dickie Pride,27,27,"March 26, 1969",1969-03-26,"London, England",Drug overdose
Benny Benjamin The Funk Brothers,43,43,"April 20, 1969",1969-04-20,"New York City, New York, USA",Stroke
Don Drummond The Skatalites,37,37,"May 6, 1969",1969-05-06,"Kingston, Jamaica, USA",Possibly heart failure and alleged suicide
Martin Lamble Fairport Convention,19,19,"May 12, 1969",1969-05-12,"Scratchwood Services, M1 Motorway, England",Car accident
Shorty Long,29,29,"June 29, 1969",1969-06-29,"Detroit, Michigan, USA",Drowning
Brian Jones The Rolling Stones,27,27,"July 3, 1969",1969-07-03,"Hartfield, East Sussex, England",Drowned in swimming pool
Wynonie Harris,53,53,"July 4, 1969",1969-07-04,"Los Angeles, California, USA",Esophageal cancer
Roy Hamilton,40,40,"July 20, 1969",1969-07-20,"New Rochelle, New York, USA",Stroke
Skip James,67,67,"October 3, 1969",1969-10-03,"Philadelphia, Pennsylvania, USA",
"Leonard Chess Record prouder, company executive and co-founder of Chess Records",52,52,"October 16, 1969",1969-10-16,"Chicago, Illinois, USA",Cardiac arrest
Tommy Edwards,47,47,"October 22, 1969",1969-10-22,"Richmond, Virginia, USA",Brain aneurysm
Pops Foster,77,77,"October 29, 1969",1969-10-29,USA,
Magic Sam,32,32,"December 1, 1969",1969-12-01,"Chicago, Illinois, USA",Heart attack
Billy Stewart,32,32,"January 17, 1970",1970-01-17,"Selma, North Carolina, USA","Car accident, mechanical failure led to car plunging off bridge into river"
L. C. McKinley,51,51,"January 19, 1970",1970-01-19,"East Chicago, Indiana, USA",
Slim Harpo,46,46,"January 31, 1970",1970-01-31,"Baton Rouge, Louisiana, USA",Heart attack
Darrell Banks,32,32,"February 24, 1970",1970-02-24,"Battle Creek, Michigan, USA",Shot by police
Mary Ann Ganser The Shangri-Las,22,22,"March 14, 1970",1970-03-14,"Forest Hills, New York, USA",Barbiturate overdose (disputed)
Kid Thomas,35,35,"April 5, 1970",1970-04-05,"Los Angeles, California, USA",Shooting
Otis Spann,40,40,"April 24, 1970",1970-04-24,"Chicago, Illinois, USA",Liver cancer
Frankie Lee Sims,53,53,"May 5, 1970",1970-05-05,"Dallas, Texas, USA",Pneumonia
Alan Wilson Canned Heat,27,27,"September 3, 1970",1970-09-03,"Topanga Canyon, California, USA",Suicide or accidental barbiturate overdose
Maxwell Davis,54,54,"September 18, 1970",1970-09-18,"Los Angeles, California, USA",
Jimi Hendrix The Jimi Hendrix Experience,27,27,"September 18, 1970",1970-09-18,"Kensington, London, England",Asphyxiation on vomit
Janis Joplin Big Brother and the Holding Company,27,27,"October 4, 1970",1970-10-04,"Los Angeles, California, USA",Heroin overdose
Baby Huey Baby Huey & the Babysitters,26,26,"October 28, 1970",1970-10-28,"Chicago, Illinois, USA",Drug related heart attack
Coot Grant,77,77,"December 26, 1970",1970-12-26,"Riverside County, California, USA",
Harold McNair Ginger Baker's Air Force,39,39,"March 7, 1971",1971-03-07,"London, England",Lung cancer
Francis Wolff,63,63,"March 8, 1971",1971-03-08,"New York City, New York, USA",
Arlester Christian Dyke & the Blazers,27,27,"March 13, 1971",1971-03-13,"Phoenix, Arizona, USA",Shot
Donald McPherson The Main Ingredient,29,29,"July 3, 1971",1971-07-03,"The Bronx, New York, USA",
Jim Morrison The Doors Rick & the Ravens,27,27,"July 3, 1971",1971-07-03,"Paris, France",Heart failure or drug overdose (disputed)
Louis Armstrong,69,69,"July 6, 1971",1971-07-06,"New York City, New York, USA",Heart attack
"Henry D. ""Homer"" Haynes Homer and Jethro",51,51,"August 7, 1971",1971-08-07,"Hammond, Indiana, USA",Heart attack
King Curtis,37,37,"August 13, 1971",1971-08-13,"New York City, New York, USA",Stabbing
Lil Hardin Armstrong,73,73,"August 27, 1971",1971-08-27,"Chicago, Illinois, USA",
Gene Vincent,36,36,"October 12, 1971",1971-10-12,"California, USA",Burst stomach ulcer
Duane Allman The Allman Brothers Band Derek and the Dominos,24,24,"October 29, 1971",1971-10-29,"Macon, Georgia, USA",Motorcycle accident
Little Junior Parker,39,39,"November 18, 1971",1971-11-18,"Blue Island, Illinois, USA",Following surgery for brain tumor
Mahalia Jackson,60,60,"January 27, 1972",1972-01-27,"Evergreen Park, Illinois, USA",Heart failure and diabetes or complications
Linda Jones,27,27,"March 14, 1972",1972-03-14,"Newark, New Jersey, USA",Complications from diabetes
Leslie Harvey Stone the Crows,27,27,"May 3, 1972",1972-05-03,"Swansea, Wales",Electrocuted by a live microphone on stage
Reverend Gary Davis,76,76,"May 5, 1972",1972-05-05,"Hammonton, New Jersey, USA",Heart attack
Clyde McPhatter Billy Ward and His Dominoes The Drifters,39,39,"June 13, 1972",1972-06-13,"Teaneck, New Jersey, USA",Heart attack
Mississippi Fred McDowell,66,66,"July 3, 1972",1972-07-03,"Memphis, Tennessee, USA",
Lovie Austin,84,84,"July 10, 1972",1972-07-10,"Chicago, Illinois, USA",
Brian Cole The Association,29,29,"August 2, 1972",1972-08-02,"Los Angeles, California, USA",Heroin overdose
Rory Storm,34,34,"September 28, 1972",1972-09-28,"Stoneycroft, Liverpool, England",Alleged suicide
Billy Murcia The New York Dolls,21,21,"November 6, 1972",1972-11-06,"London, England",Accidental suffocation due to drugs and alcohol
Berry Oakley The Allman Brothers Band,24,24,"November 11, 1972",1972-11-11,"Macon, Georgia, USA",Motorcycle accident
Danny Whitten Crazy Horse,29,29,"November 18, 1972",1972-11-18,"Los Angeles, California, USA",Accidental heroin overdose
William Manuel Johnson,100,100,"December 3, 1972",1972-12-03,"New Braunfels, Texas, USA",
Kid Ory,86,86,"January 23, 1973",1973-01-23,"Honolulu, Hawaii, USA",
"Ron ""Pigpen"" McKernan The Grateful Dead",27,27,"March 8, 1973",1973-03-08,"Corte Madera, California, USA",Gastrointestinal hemorrhage from alcoholism
Sammy Babitzin,24,24,"April 29, 1973",1973-04-29,"Jyväskylä, Finland",Visceral injuries caused by car accident
Clarence White The Kentucky Colonels The Byrds,29,29,"July 14, 1973",1973-07-14,"Palmdale, California, USA",Hit by drunk driver
Roger Lee Durham Bloodstone,27,27,"July 27, 1973",1973-07-27,USA,Fall from horse injuries
Memphis Minnie,76,76,"August 6, 1973",1973-08-06,"Memphis, Tennessee, USA",Stroke
Paul Williams The Temptations,34,34,"August 17, 1973",1973-08-17,"Detroit, Michigan, USA",
Gram Parsons,26,26,"September 19, 1973",1973-09-19,"Joshua Tree, California, USA",Morphine and alcohol overdose
Jim Croce,30,30,"September 20, 1973",1973-09-20,"Natchitoches, Louisiana, USA",Plane accident
Maury Muehleisen Jim Croce's lead guitarist,24,24,"September 20, 1973",1973-09-20,"Natchitoches, Louisiana, USA",Plane accident
Sister Rosetta Tharpe,58,58,"October 9, 1973",1973-10-09,"Philadelphia, Pennsylvania, USA",Stroke
Gene Krupa,64,64,"October 16, 1973",1973-10-16,"Yonkers, New York, USA",Leukemia
John Rostill The Shadows,31,31,"November 26, 1973",1973-11-26,"Radlett, Hertfordshire, England",Electrocuted by guitar
Bobby Darin,37,37,"December 20, 1973",1973-12-20,"Los Angeles, California, USA",Surgery to repair a mechanical heart valve
Packy Axton The Mar-Keys,32,32,January 1974,1974-01-01,"Memphis, Tennessee, USA",Cirrhosis or heart attack
Bobby Bloom,28,28,"February 28, 1974",1974-02-28,USA,Suicide
Harry Womack The Valentinos,28,28,"March 9, 1974",1974-03-09,"Los Angeles, California, USA",Stabbed to death by his girlfriend
Arthur Crudup,68,68,"March 28, 1974",1974-03-28,"Nassawadox, Virginia, USA",
Graham Bond The Graham Bond Organisation Ginger Baker's Air Force,36,36,"May 8, 1974",1974-05-08,"London, England",Suicide
Duke Ellington,75,75,"May 24, 1974",1974-05-24,"New York City, New York, USA",Pneumonia
Gene Ammons,49,49,"July 23, 1974",1974-07-23,"Chicago, Illinois, USA",Cancer
Lightnin' Slim,61,61,"July 27, 1974",1974-07-27,"Detroit, Michigan, USA",
Cass Elliot The Mamas & the Papas,34,34,"July 29, 1974",1974-07-29,"London, England",Heart failure
Bill Chase Walter Clark John Emma Wallace Yohn Chase,39 25 22 27,39,"August 9, 1974",1974-08-09,"Jackson, Minnesota, USA",Plane accident
Bill Chase Walter Clark John Emma Wallace Yohn Chase,39 25 22 27,25,"August 9, 1974",1974-08-09,"Jackson, Minnesota, USA",Plane accident
Bill Chase Walter Clark John Emma Wallace Yohn Chase,39 25 22 27,22,"August 9, 1974",1974-08-09,"Jackson, Minnesota, USA",Plane accident
Bill Chase Walter Clark John Emma Wallace Yohn Chase,39 25 22 27,27,"August 9, 1974",1974-08-09,"Jackson, Minnesota, USA",Plane accident
Ivory Joe Hunter,60,60,"November 8, 1974",1974-11-08,"Memphis, Tennessee, USA",Lung cancer
Nick Drake,26,26,"November 25, 1974",1974-11-25,"Tanworth-in-Arden, Warwickshire, England",Suicide by acute amitriptyline poisoning
Louis Jordan Louis Jordan and His Tympany Five,66,66,"February 4, 1975",1975-02-04,"Los Angeles, California, USA",Heart Attack
Dave Alexander The Stooges,27,27,"February 10, 1975",1975-02-10,"Ann Arbor, Michigan, USA",Pneumonia
T-Bone Walker,64,64,"March 16, 1975",1975-03-16,"Los Angeles, California, USA",Stroke
Pete Ham Badfinger,27,27,"April 24, 1975",1975-04-24,"Surrey, England",Suicide
Don Robey Record produer,71,71,"July 16, 1975",1975-07-16,"Houston, Texas, USA",Heart attack
Tim Buckley,28,28,"June 29, 1975",1975-06-29,"Santa Monica, California, USA",Heroin overdose
Lefty Frizzell,47,47,"July 19, 1975",1975-07-19,"Nashville, Tennessee, USA",Stroke
Cannonball Adderley,46,46,"August 8, 1975",1975-08-08,"Gary, Indiana, USA",Cerebral hemorrhage
"Al Jackson, Jr. Booker T. & the MG's",39,39,"October 1, 1975",1975-10-01,"Memphis, Tennessee, USA",Murdered by gunshot
"Gary Thain The Keef Hartley Band, Uriah Heep",27,27,"December 8, 1975",1975-12-08,"Norwood Green, England",Morphine overdose
Hound Dog Taylor,60,60,"December 17, 1975",1975-12-17,"Chicago, Illinois, USA",Lung cancer
Howlin' Wolf,65,65,"January 10, 1976",1976-01-10,"Hines, Illinois, USA",Congestive heart failure
Chris Kenner,46,46,"January 25, 1976",1976-01-25,"New Orleans, Louisiana, USA",Heart attack
Rudy Pompilli Bill Haley & His Comets,51,51,"February 5, 1976",1976-02-05,"Philadelphia, Pennsylvania, USA",Lung cancer
Florence Ballard The Supremes,32,32,"February 22, 1976",1976-02-22,"Detroit, Michigan, USA",Coronary thrombosis
"Luther ""Snake Boy"" Johnson",34,34,"March 18, 1976",1976-03-18,"Boston, Massachusetts, USA",Lung Cancer
"Paul Kossoff Free, Back Street Crawler",25,25,"March 19, 1976",1976-03-19,"Flight from New York to Los Angeles, USA",Drug-related heart attack
Phil Ochs,35,35,"April 9, 1976",1976-04-09,"New York City, New York, USA",Suicide by hanging
Keith Relf The Yardbirds,33,33,"May 14, 1976",1976-05-14,"London, England",Electrocuted by guitar
Charles Stepney Record producer and arranger,45,45,"May 17, 1976",1976-05-17,"Chicago, Illinois, USA",Heart attack
Melvin Jackson,60,60,"May 30, 1976",1976-05-30,"Dallas, Texas, USA",Car accident
Jimmy Reed,50,50,"August 29, 1976",1976-08-29,"Oakland, California, USA",Epileptic seizure
"Tommy Bolin Deep Purple, The James Gang, Zephyr",25,25,"December 4, 1976",1976-12-04,"Miami, Florida, USA",Heroin overdose
Buddy Johnson,62,62,"February 9, 1977",1977-02-09,USA,Brain tumor and Sickle Cell Anemia
Bukka White,70,70,"February 26, 1977",1977-02-26,"Memphis, Tennessee, USA",
Annette Snell,32,32,"April 4, 1977",1977-04-04,"New Hope, Georgia, USA",Southern Airways Flight 242 plane accident
Lafayette Thomas,48,48,"May 20, 1977",1977-05-20,"Brisbane, California, USA",Heart attack
William Powell The O'Jays,35,35,"May 26, 1977",1977-05-26,"Canton, Ohio, USA",Cancer
Sleepy John Estes,78,78,"June 5, 1977",1977-06-05,"Brownsville, Tennessee, USA",Stroke
Peter Laughner Pere Ubu,24,24,"June 22, 1977",1977-06-22,"Cleveland, Ohio, USA",Acute pancreatitis from alcohol and drug abuse
Baby Boy Warren,57,57,"July 1, 1977",1977-07-01,"Detroit, Michigan, USA",Heart attack
Elvis Presley,42,42,"August 16, 1977",1977-08-16,"Memphis, Tennessee, USA",Heart attack
George Barnes,56,56,"September 5, 1977",1977-09-05,"Concord, California, USA",Heart attack
Marc Bolan T. Rex,29,29,"September 16, 1977",1977-09-16,"London, England",Car accident
Bing Crosby,74,74,"October 14, 1977",1977-10-14,"Alcobendas, Spain",Heart attack
Cassie Gaines Lynyrd Skynyrd,29,29,"October 20, 1977",1977-10-20,"Gillsburg, Mississippi, USA",Plane accident
Steve Gaines Lynyrd Skynyrd,28,28,"October 20, 1977",1977-10-20,"Gillsburg, Mississippi, USA",Plane accident
Ronnie Van Zant Lynyrd Skynyrd,29,29,"October 20, 1977",1977-10-20,"Gillsburg, Mississippi, USA",Plane accident
Terry Kath Chicago,31,31,"January 23, 1978",1978-01-23,"Los Angeles, California, USA",Accidentally shot himself
"Gregory Herbert Blood, Sweat & Tears",30,30,"January 31, 1978",1978-01-31,"Amsterdam, Netherlands",Heroin overdose
Bill Kenny The Ink Spots,63,63,"March 23, 1978",1978-03-23,"New Westminster, Canada",Respiratory illness
Sandy Denny Fairport Convention,31,31,"April 21, 1978",1978-04-21,"London, England",Cerebral hemorrhage after accidental fall
Brian Pilling Fludd,29,29,"June 28, 1978",1978-06-28,Canada,Cancer
Glenn Goins Parliament-Funkadelic,24,24,"July 29, 1978",1978-07-29,USA,Hodgkin's lymphoma
Joe Negroni Frankie Lymon and the Teenagers,37,37,"September 5, 1978",1978-09-05,"New York City, New York, USA",Cerebral hemorrhage
Tom Wilson Record producer,47,47,"September 6, 1978",1978-09-06,"Los Angeles, California, USA",Heart attack
Keith Moon The Who,32,32,"September 7, 1978",1978-09-07,"London, England",Heminevrin overdose
Johnny O'Keefe,43,43,"October 6, 1978",1978-10-06,"Darlinghurst, New South Wales, Australia",Heart attack
Chris Bell Big Star,27,27,"December 27, 1978",1978-12-27,"East Memphis, Tennessee, USA",Car accident
Donny Hathaway,33,33,"January 13, 1979",1979-01-13,"New York City, New York, USA",Suicide or accidental fall
Grant Green,43,43,"January 31, 1979",1979-01-31,,
"Sid Vicious Sex Pistols, Siouxsie and the Banshees, Vicious White Kids, The Flowers of Romance",21,21,"February 2, 1979",1979-02-02,"New York City, New York, USA",Suicide or accidental heroin overdose
James Leroy Denim,32,32,"May 10, 1979",1979-05-10,"Ottawa, Ontario, Canada",Suicide
Lowell George Little Feat,34,34,"June 29, 1979",1979-06-29,"Arlington, Virginia, USA",Heart attack
Van McCoy,39,39,"July 6, 1979",1979-07-06,"Englewood, New Jersey, USA",Heart attack
Minnie Riperton,31,31,"July 12, 1979",1979-07-12,"Los Angeles, California, USA",Breast cancer
Dorsey Burnette The Rock and Roll Trio,46,46,"August 19, 1979",1979-08-19,"Los Angeles, California, USA",Coronary thrombosis
"Jimmy McCulloch Thunderclap Newman, Stone The Crows, Wings",26,26,"September 27, 1979",1979-09-27,"London, England",Morphine poisoning
Gus Cannon,96,96,"October 15, 1979",1979-10-15,"Memphis, Tennessee, USA",
"Tiki Fulwood Parliament, Funkadelic",35,35,"October 29, 1979",1979-10-29,USA,Stomach cancer
Twiggs Lyndon Roadie for The Allman Brothers Band,37,37,"November 16, 1979",1979-11-16,"Duanesburg, New York, USA",Plane accident
John Glascock Jethro Tull,28,28,"November 17, 1979",1979-11-17,"London, England",Congenital heart defect
Jackie Brenston Kings of Rhythm,49,49,"December 15, 1979",1979-12-15,"Memphis, Tennessee, USA",Heart attack
Georgeanna Tillman The Marvelettes,35,35,"January 6, 1980",1980-01-06,"Inkster, Michigan, USA",Complications from sickle cell anemia and lupus
Professor Longhair,61,61,"January 23, 1980",1980-01-23,"New Orleans, Louisiana, USA",Heart attack
Jimmy Durante,86,86,"January 29, 1980",1980-01-29,"Santa Monica, California, USA",Pneumonia
Warren Smith,47,47,"January 30, 1980",1980-01-30,,Heart attack
Bon Scott AC/DC,33,33,"February 19, 1980",1980-02-19,"London, England",Alcohol poisoning after all night drinking binge
Jacob Miller,27,27,"March 23, 1980",1980-03-23,"Kingston, Jamaica",Car accident
Ian Curtis Joy Division,23,23,"May 18, 1980",1980-05-18,"Macclesfield, England",Suicide by hanging
Carl Radle Derek and the Dominos,37,37,"May 30, 1980",1980-05-30,,Kidney infection
Malcolm Owen The Ruts,25,25,"July 14, 1980",1980-07-14,"Hayes, Middlesex, England",Heroin overdose
Keith Godchaux The Grateful Dead,32,32,"July 23, 1980",1980-07-23,"Marin County, California, USA",Automobile accident
Warren Smith,47,47,"January 30, 1980",1980-01-30,USA,Heart attack
"George Scott III The Raybeats, 8 Eyed Spy, James Chance and the Contortions, James White and the Blacks, Human Switchboard",26,26,"August 5, 1980",1980-08-05,"New York City, New York, USA",Heroin overdose
John Bonham Led Zeppelin,32,32,"September 25, 1980",1980-09-25,"Windsor, England",Asphyxiation on vomit
Pat Hare,49,49,"September 26, 1980",1980-09-26,"St. Paul Minnesota, USA",Lung cancer
Bobby Lester The Moonglows,49,49,"October 15, 1980",1980-10-15,"Louisville, Kentucky, USA",Lung cancer
Steve Peregrin Took Tyrannosaurus Rex,31,31,"October 27, 1980",1980-10-27,"Ladbroke Grove, London, England",Asphyxiation after inhaling a cocktail cherry
O.V. Wright,41,41,"November 16, 1980",1980-11-16,"Mobile, Alabama, USA",Heart attack
Darby Crash Germs,22,22,"December 7, 1980",1980-12-07,"Los Angeles, California, USA",Suicide by intentional heroin overdose
John Lennon The Beatles,40,40,"December 8, 1980",1980-12-08,"New York City, New York, USA",Shot to death by Mark David Chapman
Tim Hardin,39,39,"December 29, 1980",1980-12-29,"Los Angeles, California, USA",Morphine and heroin overdose
Robert Pete Williams,66,66,"December 31, 1980",1980-12-31,"Rosedale, Louisiana, USA",
David Lynch The Platters,51,51,"January 2, 1981",1981-01-02,"Long Beach, California, USA",Cancer
Bill Haley Bill Haley & His Comets,55,55,"February 9, 1981",1981-02-09,"Harlingen, Texas, USA",Brain tumor or heart attack (disputed)
Mike Bloomfield,37,37,"February 15, 1981",1981-02-15,"San Francisco, California, USA",Heroin overdose
Tampa Red Tampa Red and His Chicago Five,77,77,"March 19, 1981",1981-03-19,"Chicago, Illinois, USA",
Bob Hite Canned Heat,38,38,"April 6, 1981",1981-04-06,"Los Angeles, California, USA",Heart attack
Steve Currie T. Rex,33,33,"April 28, 1981",1981-04-28,"Vale de Parra, Algarve, Portugal",Car accident
Bob Marley The Wailers,36,36,"May 11, 1981",1981-05-11,"Miami, Florida, USA",Acral lentiginous melanoma (suspicious)
Ernie Freeman,58,58,"May 16, 1981",1981-05-16,"Los Angeles, California, USA",Heart attack
Roy Brown,55,55,"May 25, 1981",1981-05-25,"San Fernando, California, USA",Heart attack
Chuck Wagon The Dickies,24,24,"June 28, 1981",1981-06-28,"San Fernando Valley, Los Angeles, California, USA",Shooting himself in the head
Rushton Moreve Steppenwolf,32,32,"July 1, 1981",1981-07-01,"Los Angeles, California, USA",Car accident
Hubert Johnson The Contours,40,40,"July 11, 1981",1981-07-11,"Detroit, Michigan, USA",
Harry Chapin,38,38,"July 16, 1981",1981-07-16,"Jericho, New York, USA",Car accident
Sandra Tilley The Velvelettes Martha and the Vandellas,38,38,"September 9, 1981",1981-09-09,"Las Vegas, Nevada, USA",Complications from brain surgery
Furry Lewis,88,88,"September 14, 1981",1981-09-14,"Memphis, Tennessee, USA",Heart failure
Big Walter Horton,60,60,"December 8, 1981",1981-12-08,"Chicago, Illinois, USA",Heart failure
